The Harafish,"Mahfouz, Naguib",89803944,"Cobham, Catherine ",24756669,Doubleday,N,0,N,0,1993,USA,Arabic,1977,Egypt,M,1,Egypt,26.820553,30.802498,F,0,UK,55.378051,-3.435973,Novel,406,,"Translator's Introduction,   Glossary",N,0,-,-,-,0,-,0,-,0,-,0,0,-,-
Thebes at War,"Mahfouz, Naguib",89803944,"Davies, Humphrey",228562256,Anchor,N,0,N,0,2005,UK,Arabic,1944,Egypt,M,1,Egypt,26.820553,30.802498,M,1,UK,55.378051,-3.435973,Novel,242,,Introduction,N,0,-,-,-,0,-,0,-,0,-,0,0,-,-
Respected Sir,"Mahfouz, Naguib",89803944,"El-Enany, Rasheed",97601908,Doubleday,N,0,N,0,1986,USA,Arabic,1975,Egypt,M,1,Egypt,26.820553,30.802498,M,1,UK,55.378051,-3.435973,Novel,178,,Author Bio,N,0,-,-,-,0,-,0,-,0,-,0,0,-,-
The Beginning and the End,"Mahfouz, Naguib",89803944,"Hanna Awad, Ramses",59403106,AUC,Y,1,N,0,1985,USA,Arabic,1956,Egypt,M,1,Egypt,26.820553,30.802498,M,1,Egypt,26.820553,30.802498,Novel,367,,Author Bio,N,0,-,-,-,0,-,0,-,0,-,0,0,-,-
In the Time of Love,"Mahfouz, Naguib",89803944,"Heikkinen, Kay",159960173,AUC,Y,1,Y,1,2010,Egypt,Arabic,1980,Egypt,M,1,Egypt,26.820553,30.802498,F,0,USA,37.09024,-95.712891,Novel,119,,"Author Bio,   Glossary",Y,1,21,,"fatiha, iftar, kuttab, lailat al-qadr",1,"basbusa, bastirma, fuul, mouloukhiya, spatis",1,"abaya, gallabiya",1,"abu, umm, fitiwwa, khamasin, khawaga, si, sitt, ustaz",1,1,-,-
The Beggar,"Mahfouz, Naguib",89803944,"Henry, Kristin Walker & al-Warraki, Nariman Khales Naili","164322558, 10018078",Doubleday,N,0,N,0,1986,USA,Arabic,1965,Egypt,M,1,Egypt,26.820553,30.802498,"F, F",0,Egypt,26.820553,30.802498,Novel,132,,Author Bio,N,0,-,-,-,0,-,0,-,0,-,0,0,-,-
Cairo Modern,"Mahfouz, Naguib",89803944,"Hutchins, William M.",12461356,Anchor,N,0,N,0,2008,USA,Arabic,1945,Egypt,M,1,Egypt,26.820553,30.802498,M,1,USA,37.09024,-95.712891,Novel,240,,"Glossary,   Afterword",Y,1,37,,"dhikr, hanbali, mahdi, zakat",1,"ful, ful midammis, mish",1,gallabiya,1,"tuzz, umm, wafd party",1,1,-,-
"
The Cairo Trilogy: Palace Walk, Palace of Desire, Sugar Street ","Mahfouz, Naguib",89803944,"Hutchins, William M. & Kenny, Olive E. & Kenny, Lorne M. & Samaan, Angele Botros",12461356,Alfred A. Knopf,N,0,N,0,2001,USA,Arabic,"1956, 1957",Egypt,M,1,Egypt,26.820553,30.802498,"M, F, M, F",-,"USA, Canada, Egypt",,,Novel,1313,,"Dedication,   Contents Page,   Introduction,   A Note on Transliteration",N,0,-,-,-,0,-,0,-,0,-,0,0,-,-
The Search,"Mahfouz, Naguib",89803944,"Islam, Mohamed",31996761,Doubleday,N,0,N,0,1987,USA,Arabic,1964,Egypt,M,1,Egypt,26.820553,30.802498,M,1,-,,,Novel,133,,Glossary,N,0,-,-,-,0,-,0,-,0,-,0,0,-,-
The Journey of Ibn Fattouma,"Mahfouz, Naguib",89803944,"Johnson-Davies, Denys",75051071,Doubleday,N,0,N,0,1992,USA,Arabic,1983,Egypt,M,1,Egypt,26.820553,30.802498,M,1,Egypt,26.820553,30.802498,Novel,148,,Introduction,N,0,-,-,-,0,-,0,-,0,-,0,0,-,-
Wedding Song,"Mahfouz, Naguib",89803944,"Kenny, Olive E. ",46873607,Doubleday,N,0,N,0,1989,USA,Arabic,1981,Egypt,M,1,Egypt,26.820553,30.802498,F,0,Canada,56.130366,-106.346771,Novel,161,,"Translator's Introduction,   Prologue",Y (Notes),1,15,"imam, bismallah, Cairo geography, feddan, Magnun Leyla, sentence used in war with Israel, Coptic month","imam, bismallah",1,-,0,-,0,"Cairo geography, feddan, Magnun Leyla, sentence used in war with Israel, Coptic month",1,1,-,-
Midaq Alley,"Mahfouz, Naguib",89803944,"Le Gassick, Trevor",66476267,Three Continents,N,0,Y,1,1981,USA,Arabic,1966,Lebanon,M,1,Egypt,26.820553,30.802498,M,1,USA,37.09024,-95.712891,Novel,246,,"Images,   Introduction",N,0,-,-,-,0,-,0,-,0,-,0,0,-,-
The Thief and the Dogs,"Mahfouz, Naguib",89803944,"Le Gassick, Trevor & Badawi, M.M.","66476267, 19717732",Doubleday,N,0,N,0,1989,USA,Arabic,1961,Egypt,M,1,Egypt,26.820553,30.802498,"M, M",1,"USA, UK",38.9201906,-77.0628269,Novel,145,,"Translator's Acknowledgements,   Contents Page,   Author Bio,   Translator Bio",N,0,-,-,-,0,-,0,-,0,-,0,0,-,-
Adrift on the Nile,"Mahfouz, Naguib",89803944,"Liardet, Frances ",,Doubleday,N,0,N,0,1993,USA,Arabic,1966,Egypt,M,1,Egypt,26.820553,30.802498,F,0,UK,55.378051,-3.435973,Novel,167,,"Dedication,   Translator's Acknowledgements,   Translator's Introduction,   Author Bio",N,0,-,-,-,0,-,0,-,0,-,0,0,-,-
The Day the Leader was Killed,"Mahfouz, Naguib",89803944,"Mashem, Malak",283226333,Anchor,N,0,N,0,1997,USA,Arabic,1985,Egypt,M,1,Egypt,26.820553,30.802498,F,0,-,,,Novel,101,,"Author Bio,   Illustrator Bio,   Translator Bio,   Translator's Introduction",N,0,-,-,-,0,-,0,-,0,-,0,0,-,-
Miramar,"Mahfouz, Naguib",89803944,"Moussa-Mahmoud, Fatma",97004020,Heinemann,N,0,Y,1,1978,UK,Arabic,1967,Egypt,M,1,Egypt,26.820553,30.802498,F,0,Egypt,26.820553,30.802498,Novel,130,,"Contents Page,   Translator's Note,   Author Bio",Y (Notes),1,66,,iblis,1,-,0,"melaya, gallabiyya",1,"pasha, Umm Kulthum, feddan, fellaha, ustaz",1,1,-,-
Miramar,"Mahfouz, Naguib",89803944,"Moussa-Mahmoud, Fatma",97004020,Three Continents,N,0,Y,1,1983,USA,Arabic,1967,Egypt,M,1,Egypt,26.820553,30.802498,F,0,Egypt,26.820553,30.802498,Novel,130,,Introduction,Y (Notes),1,66,"Koranic/historical explanations, iblis, gallabiyya, Cairo geography",iblis,1,-,0,gallabiyya,1,"Cairo geography, explanations",1,1,-,-
Morning and Evening Talk,"Mahfouz, Naguib",89803944,"Phillips, Christina",21963312,AUC,Y,1,Y,1,2007,Egypt,Arabic,1987,Egypt,M,1,Egypt,26.820553,30.802498,F,0,UK,55.378051,-3.435973,Novel,204,,Glossary,Y,1,36,,dervish,1,-,0,gallabiya,1,"bey, effendi, hanem, infitah, mashrabiya, narghile, pasha, sidi, umma party, watani party",1,1,-,-
The Mirage,"Mahfouz, Naguib",89803944,"Roberts, Nancy",47001671,Anchor,N,0,N,0,2009,UK,Arabic,1948,Egypt,M,1,Egypt,26.820553,30.802498,F,0,USA,37.09024,-95.712891,Novel,470,,"Author and Translator Bio,   Translator's Introduction,   Map,    Notes (after translator's introduction)",Y,1,13,"Munira al-Mahdiya, Umm Kulthum, eid al-adha, eid al-fitr, fatiha, magzub, Sayyida Zaynab's shrine, throne verse, fuul, djinn, al-gadeed","eid al-adha, eid al-fitr, fatiha, magzub, Sayyida Zaynab's shrine, throne verse",1,fuul,1,-,0,"djinn, al-gadeed",1,1,-,-
Love in the Rain,"Mahfouz, Naguib",89803944,"Roberts, Nancy",47001671,AUC,Y,1,Y,1,2011,Egypt,Arabic,1973,Egypt,M,1,Egypt,26.820553,30.802498,F,0,USA,37.09024,-95.712891,Novel,130,,"Translator's Afterword,   Notes",Y,1,8,"Amm, Sidi al-Bayyumi, the 1919 generation, shisha",-,0,-,0,-,0,"amm, shisha, Sidi al-Bayyumi, the 1919 generation",1,1,-,-
Fountain and Tomb,"Mahfouz, Naguib",89803944,"Sobhi, Soad & Fatthouh, Essam & Kenneson, James","287946853, 279977144, 306342426",Three Continents,N,0,Y,1,1988,USA,Arabic,1975,Egypt,M,1,Egypt,26.820553,30.802498,"F,M,M",-,-,,,Novel,118,,"Contents Page,   Translator's Foreword,   Introduction,   Footnotes",Y,1,38,"afreet, dervish, exordium, imam, jinn, shiekh, sufi, sura, takiya, waqf, zar, falafel, halwa, leban, gallabiya, malaya, alma, booza, bouri, dallala, fellah/fellahah/fellaheen, futuwa, ghurza, hookah, kanoon, manzool, mashta, muallim, oud, riq","afreet, dervish, exordium, imam, jinn, shiekh, sufi, sura, takiya, waqf, zar",1,"falafel, halwa, leban, ",1,"gallabiya, malaya, ",1,"alma, booza, bouri, dallala, fellah/fellahah/fellaheen, futuwa, ghurza, hookah, kanoon, manzool, mashta, muallim, oud, riq",1,1,-,1986 Arab League Translation Award
Children of Gebelawi,"Mahfouz, Naguib",89803944,"Stewart, Phillip ",-,Heinemann,N,0,N,0,1981,UK,Arabic,1959,Lebanon,M,1,Egypt,26.820553,30.802498,M,1,UK,55.378051,-3.435973,Novel,355,,"Contents Page,   Author Bio,   Translator Bio",N,0,-,-,-,0,-,0,-,0,-,0,0,-,-
Khufu's Wisdom,"Mahfouz, Naguib",89803944,"Stock, Raymond",58084540,Anchor,N,0,N,0,2003,UK,Arabic,1939,Egypt,M,1,Egypt,26.820553,30.802498,M,1,USA,37.09024,-95.712891,Novel,187,,"Dedication,   Translator's Introduction,   Notes",Y,1,15,"Coptic calendar, historical references",-,0,-,0,-,0,"Coptic calendar, historical references",1,1,-,-
The Dreams,"Mahfouz, Naguib",89803944,"Stock, Raymond",58084540,AUC,Y,1,N,0,2004,Egypt,Arabic,2000,Egypt,M,1,Egypt,26.820553,30.802498,M,1,USA,37.09024,-95.712891,Novel,120,,"Author Bio,   Contents Page",Y,1,23,"Cairo geography, birth-feast of Husayn, fuul, gallabiya, kunafa, jellaba, jubba, mahmal, rabab, tagin, 'ud, Egyptian figures",-,0,"fuul, kunafa, tagin",1,"gallabiya, jellaba, jubba",1,"Cairo geography, birth-feast of Husayn, mahmal, rabab, 'ud, Egyptian figures",1,1,-,-
The Coffeehouse,"Mahfouz, Naguib",89803944,"Stock, Raymond",58084540,AUC,Y,1,Y,1,2010,Egypt,Arabic,1988,Egypt,M,1,Egypt,26.820553,30.802498,M,1,USA,37.09024,-95.712891,Novel,135,,Translator's Afterword,N,0,-,-,-,0,-,0,-,0,-,0,0,-,-
Before the Throne,"Mahfouz, Naguib",89803944,"Stock, Raymond T",58084540,AUC,Y,1,N,0,2009,Egypt,Arabic,1983,Egypt,M,1,Egypt,26.820553,30.802498,M,1,USA,37.09024,-95.712891,Novel,144,,"Translator's Introduction,   Map,   Glossary",Y (Notes),1,29,-,-,0,-,0,-,0,-,0,0,-,-
Children of the Alley,"Mahfouz, Naguib",89803944,"Theroux, Peter ",92000990,Doubleday,N,0,N,0,1996,USA,Arabic,1959,Egypt,M,1,Egypt,26.820553,30.802498,M,1,USA,37.09024,-95.712891,Novel,440,,Glossary,N,0,-,-,-,0,-,0,-,0,-,0,0,-,-
The Rising from the Coffin,"Mahmud, Mustafa",56722093,"Bishai, David",18384260,Arab Writer Publishers and Printers,N,0,N,0,1967,Egypt,Arabic,1965,Egypt,M,1,Egypt,26.820553,30.802498,M,1,-,,,Novel,118,,None,N,0,-,-,-,0,-,0,-,0,-,0,0,-,-
Memories of a Meltdown,"Makhzangi, Mohamed",5264031,"Selim, Samah",44579998,AUC,Y,1,N,0,2006,Egypt,Arabic,1997,Egypt,M,1,Egypt,26.820553,30.802498,F,0,USA,37.09024,-95.712891,Memoir,100,,None,N,0,-,-,-,0,-,0,-,0,-,0,0,-,-
The Loved Ones,"Mamdouh, Alia",123943,"Booth, Marilyn ",14901543,AUC,Y,1,Y,1,2016,Egypt,Arabic,2003,Lebanon,F,0,France,46.227638,2.213749,F,0,USA,37.09024,-95.712891,Novel,276,,"Foreword,   Editor's Note,   Glossary,   Afterword,   Publisher Information",N,0,-,-,-,0,-,0,-,0,-,0,0,Naguib Mahfouz Medal,
Naphtalene,"Mamdouh, Alia",123943,"Theroux, Peter",92000990,The Feminist Press at CUNY,Y,1,N,0,2005,USA,Arabic,1986,Egypt,F,0,France,46.227638,2.213749,M,1,USA,37.09024,-95.712891,Novel,190,,"Dedication,   Translator's note,  Translator's acknowledgements",Y (Notes),1,5,"abaya, khishkhash, umm, Prophet's hairs",Prophet's hairs,1,khishkhash,1,abaya,1,"abu, umm",1,0,-,-
Mothballs,"Mamduh, Alia",123943,"Theroux, Peter",92000990,Garnet,N,0,Y,1,1996,UK,Arabic,1986,Egypt,F,0,"Iraq, France",33.312053,44.4216241,M,1,USA,37.09024,-95.712891,Novel,162,,"Introduction,   Glossary,   Author and Translator Bio",Y,1,4,,-,0,-,0,abaya,1,"abu, umm, khishkhash",1,0,-,-
32,"Mandour, Sahar",78999039,"Fares, Nicole",179145541813996601467,Syracuse,Y,1,Y,1,2016,USA,Arabic,2010,Lebanon,F,0,Lebanon,33.854721,35.862285,F,0,USA,37.09024,-95.712891,Novel,133,,"Dedication,   Translator's Dedication,   Translator's Introduction,   Quotation,   Glossary,   Author and Translator Bio",Y,1,30,"hamra street, ras beirut, shadia",-,0,-,0,-,0,"Fairuz, fitnah, Umm Kulthum, Sabah",1,1,-,-
The Woman of the Flask ,"Matar, Selim ",59150624,"Clark, Peter ",108191551,AUC,Y,1,N,0,2005,Egypt,Arabic,1990,Lebanon,M,1,Iraq,33.223191,43.679291,M,1,UK,55.378051,-3.435973,Novel,152,,Introduction,N,0,-,-,-,0,-,0,-,0,-,0,0,al-Naqid Award in 1990,-
The Beekeeper,"Mikhail, Dunya",118702390,"Mikhail, Dunya & Weiss, Max","118702390, 107347284",New Directions,N,0,N,0,2018,USA,Arabic,2017,Italy,F,0,Iraq,33.223191,43.679291,"F, M",-,USA,37.09024,-95.712891,Novel,211,,"Images,   Author's Preface,   Image,    Arabic text",N,0,-,-,-,0,-,0,-,0,-,0,0,-,-
Diary of a Wave Outside the Sea,"Mikhail, Dunya",118702390,"Winslow, Elizabeth",41233077,New Directions,N,0,Y,1,2009,USA,Arabic,1995,Iraq,F,0,Iraq,33.223191,43.679291,"F, M",0,USA,37.09024,-95.712891,Memoir,49,,"Acknowledgements,   Contents Page",N,0,-,-,-,0,-,0,-,0,-,0,0,2010 Arab American Book Award for poetry,-
Sun on a Cloudy Day,"Mina, Hanna",76343348,"Frangieh, Bassam & Brown, Clementina","28219068, 273310816",Passeggiata,N,0,Y,1,1997,USA,Arabic,1973,Syria,M,1,Syria,34.802075,38.996815,"M,F",-,Lebanon,33.854721,35.862285,Novel,190,,"Preface,   Contents Page,   Introduction,   Notes",Y (Notes),1,21,"bashraf, tahmilah, mazhar, samah, debka, wali, mutasarrif, bey ",-,0,-,0,-,0,"bashraf, tahmilah, mazhar, samah, debka, wali, mutasarrif, bey ",1,0,-,-
Fragments of Memory,"Mina, Hanna",76343348,"Kenny, Olive & Kenny, Lorne","46873607, 69043237",Interlink,N,0,Y,1,2004,USA,Arabic,1975,Syria,F,0,Syria,34.802075,38.996815,"M, F",-,Canada,56.130366,-106.346771,Novel,180,,"Introduction,   Acknowledgements,   Notes",Y (Notes),1,unnumbered,"mushabbak, mukhtar, al-raghat, sharma, afreet, fellah, arrack, durra, lazma, murbaa' niya, tasit al-raba, wishah, hareesa, al-asba, eiran, mujaddara",-,0,"mushabbak, arrack, durra, hareesa, mujaddara",1,"wishah, al-asba, eiran",1,"mukhtar, al-raghat, sharma, afreet, fellah, lazma, murbaa' niya, tasit al-raba",1,0,-,-
Status: Emo,"Mosbah, Eslam",147008551,"Cohen, Raphael",82920405,AUC,Y,1,Y,1,2013,Egypt,Arabic,2010,Egypt,M,1,Egypt,26.820553,30.802498,M,1,Egypt,26.820553,30.802498,Novel,164,,"Author's Acknowledgements,   Glossary",Y,1,15,"Egyptian figures (eg Umm Kulthum), amm, bawwab, fuul, haram, hijab, niqab, shisha, ya layli, ya layli",-,0,fuul,1,"hijab, niqab",1,"Egyptian figures, amm, bawwab, haram, shisha, ya layli",1,1,-,-
A Tunisian Tale,"Mosbahi, Hassouna",63235656,"Weiss, Max",107347284,AUC,Y,1,Y,1,2011,Egypt,Arabic,2008,UAE,M,1,Tunisia,33.886917,9.537499,M,1,USA,37.09024,-95.712891,Novel,139,,Glossary,Y,1,20,"Tunisian figures, Azrael, fatira, malouf, shashiya cap, umma","Azrael, umma",1,fatira,1,shashiya cap,1,"Tunisian figures, malouf",1,1,-,-
Memory in the Flesh,"Mosteghanemi, Ahlam ",119088257,"Ahmar Sreih, Baria",74128961,AUC,Y,1,N,0,2000,Egypt,Arabic,1985,Lebanon,F,0,Lebanon,33.854721,35.862285,F,0,Lebanon,33.854721,35.862285,Novel,245,,"Dedication,   Translator's Note",N,0,-,-,-,0,-,0,-,0,-,0,0,Naguib Mahfouz Medal for Literature (1999),-
Chaos of the Senses,"Mosteghanemi, Ahlam ",119088257,"Ahmar Sreih, Baria ",74128961,AUC,Y,1,N,0,2004,Egypt,Arabic,1998,Lebanon,F,0,Lebanon,33.854721,35.862285,F,0,Lebanon,33.854721,35.862285,Novel,224,,Dedication,N,0,-,-,-,0,-,0,-,0,-,0,0,-,-
Memory in the Flesh (revised translation),"Mosteghanemi, Ahlam ",119088257,"Ahmar Sreih, Baria & Clark, Peter ",74128961,AUC,Y,1,N,0,2003,Egypt,Arabic,1985,Lebanon,F,0,Lebanon,33.854721,35.862285,"F, M",-,Lebanon,33.854721,35.862285,Novel,262,,"Dedication,   Translator's Note",N,0,-,-,-,0,-,0,-,0,-,0,0,-,-
The Bridges of Constantine ,"Mosteghanemi, Ahlam ",119088257,"Cohen, Raphael",82920405,Bloomsbury,N,0,N,0,2014,UK,Arabic,1993,Lebanon,F,0,Algeria,28.033886,1.659626,M,1,Egypt,26.820553,30.802498,Novel,305,,"Glossary,   Translator's Introduction,   Quotation,   Author Bio,   Translator Bio",N,0,-,-,-,0,-,0,-,0,-,0,0,1998 Naguib Mahfouz Medal for Literature,-
The Dust of Promises,"Mosteghanemi, Ahlam ",119088257,"Roberts, Nancy",47001671,Bloomsbury ,N,0,N,0,2016,UK,Arabic,2009,Lebanon,F,0,Lebanon,33.854721,35.862285,F,0,USA,37.09024,-95.712891,Novel,294,,"Dedication,   Author Bio,   Translator Bio",Y,1,37,"eid, fatiha, bouzellouf, qalb al-lawz, zalabia, disadasha, hijab, malaya, zindali","eid, fatiha, ",1,"bouzellouf, qalb al-lawz, zalabia",1,"disadasha, hijab, malaya",1,zindali,1,1,-,-
Vertigo,"Mourad, Ahmed",17016449,"Moger, Robin",121559456,A&C Black,N,0,N,0,2011,Qatar,Arabic,2007,Egypt,M,1,Egypt,26.820553,30.802498,M,1,South Africa,-30.559482,22.937506,Novel,369,,"Acknowledgements,   Glossary,   Translator Bio",Y,1,33,"Prophet Youssef, bismillah, eid, hajj, haram, jinn, nadaha, rakaa, bastirma, eish wa malh, fuul, irqsus, khalta rice, koshari, molokhiyya, shawerma, gallabiya, hijab, khimar, niqab, basha, bey, nuqta, piastre","bismillah, eid, hajj, haram, jinn, nadaha, rakaa, ",1,"bastirma, eish wa malh, fuul, irqsus, khalta rice, koshari, molokhiyya, shawerma",1,"gallabiya, hijab, khimar, niqab, ",1,"basha, bey, nuqta, piastre",1,1,-,The Mediterranean Culture Award of 2013
Seeds of Corruption,"Moussa, Sabri ",64230721,"Mikhail, Mona",69031580,Houghton Mifflin,N,0,Y,1,1980,USA,Arabic,1976,Egypt,M,1,Egypt,26.820553,30.802498,F,0,USA,37.09024,-95.712891,Novel,169,,"Dedication,   Publisher's Note,   Glossary",Y,1,19,"am, bey, effendi, fatiha, al-hajj, hanim, jabal, jallabiyya, al-khawaja, muharram, sheikh","fatiha, al-hajj, muharram",1,-,0,jallabiyya,1,"am, bey, effendi, hanim",1,0,-,-
Seeds of Corruption,"Moussa, Sabri ",64230721,"Mikhail, Mona",69031580,Interlink,N,0,Y,1,2002,USA,Arabic,1976,Egypt,M,1,Egypt,26.820553,30.802498,F,0,USA,37.09024,-95.712891,Novel,169,,Glossary,Y,1,19,"am, bey, effendi, fatiha, al-hajj, hanim, jabal, jallabiyya, al-khawaja, muharram, sheikh","fatiha, al-hajj, muharram",1,-,0,jallabiyya,1,"am, bey, effendi, hanim",1,0,-,-
Love with a Few Hairs,"Mrabet, Mohammed",95199239,"Bowles, Paul",112464042,City Lights,N,0,Y,1,1968,USA,Arabic,-,-,M,1,Morocco,31.791702,-7.09262,M,1,Morocco,31.791702,-7.09262,Novel,198,,None,N,0,-,-,-,0,-,0,-,0,-,0,0,-,-
The Boy Who Set the Fire,"Mrabet, Mohammed",95199239,"Bowles, Paul",112464042,Black Sparrow,N,0,Y,1,1974,USA,Arabic,-,-,M,1,Morocco,31.791702,-7.09262,M,1,Morocco,31.791702,-7.09262,Short stories,115,,"Image,   Author Bio,   Translator Bio,    Illustrator Bio,   Bibliography,   Translator's bibliography",N,0,-,-,-,0,-,0,-,0,-,0,0,-,-
Look and Move On,"Mrabet, Mohammed",95199239,"Bowles, Paul",112464042,Black Sparrow,N,0,Y,1,1976,USA,Arabic,-,-,M,1,Morocco,31.791702,-7.09262,M,1,"Morocco, USA",40.9461457,-87.4533626,Novel,119,,Author Bio,N,0,-,-,-,0,-,0,-,0,-,0,0,-,-
The Big Mirror,"Mrabet, Mohammed",95199239,"Bowles, Paul",112464042,Black Sparrow,N,0,Y,1,1977,USA,Arabic,-,-,M,1,Morocco,31.791702,-7.09262,M,1,"Morocco, USA",40.9461457,-87.4533626,Novel,71,,"Author Bio,   Translator Bio",N,0,-,-,-,0,-,0,-,0,-,0,0,-,-
The Beach Cafe,"Mrabet, Mohammed",95199239,"Bowles, Paul",112464042,Black Sparrow,N,0,Y,1,1980,USA,Arabic,-,-,M,1,Morocco,31.791702,-7.09262,M,1,"Morocco, USA",40.9461457,-87.4533626,Novel,78,,Author Bio,N,0,-,-,-,0,-,0,-,0,-,0,0,-,-
The Lemon,"Mrabet, Mohammed",95199239,"Bowles, Paul",112464042,City Lights,N,0,Y,1,1986,USA,Arabic,1969,-,M,1,Morocco,31.791702,-7.09262,M,1,Morocco,31.791702,-7.09262,Novel,176,,Quotation,N,0,-,-,-,0,-,0,-,0,-,0,0,-,-
Marriage with Papers,"Mrabet, Mohammed",95199239,"Bowles, Paul",112464042,Tombouctou Books,N,0,N,0,1986,USA,Arabic,-,-,M,1,Morocco,31.791702,-7.09262,M,1,Morocco,31.791702,-7.09262,Short stories,67,,Contents Page,N,0,-,-,-,0,-,0,-,0,-,0,0,-,-
Chocolate Creams and Dollars,"Mrabet, Mohammed",95199239,"Bowles, Paul",112464042,Inanout Press,N,0,Y,1,1992,USA,Arabic,-,-,M,1,Morocco,31.791702,-7.09262,M,1,"Morocco, USA",40.9461457,-87.4533626,Short stories,178,,"Dedication,   Translator's Acknowledgements",N,0,-,-,-,0,-,0,-,0,-,0,0,-,-
Endings,"Munif, Abdelrahman ",95290221,"Allen, Roger",22256175,Quartet,N,0,N,0,1988,USA,Arabic,1977,Egypt,M,1,Syria ,34.802075,38.996815,M,1,USA,37.09024,-95.712891,Novel,140,,"Translator's Note,   Author and Translator Bio",N,0,-,-,-,0,-,0,-,0,-,0,0,-,-
Cities of Salt,"Munif, Abdelrahman ",95290221,"Theroux, Peter",92000990,Vintage International,N,0,N,0,1989,USA,Arabic,1984,Lebanon,M,1,Syria,34.802075,38.996815,M,1,USA,37.09024,-95.712891,Novel,627,,"Quotation,   Quotation,   Author and Translator Bio",N,0,-,-,-,0,-,0,-,0,-,0,0,-,-
The Trench,"Munif, Abdelrahman ",95290221,"Theroux, Peter",92000990,Pantheon,N,0,N,0,1991,USA,Arabic,1986,Lebanon,M,1,Syria,34.802075,38.996815,M,1,USA,37.09024,-95.712891,Novel,554,,Translator's Introduction,N,0,-,-,-,0,-,0,-,0,-,0,0,-,-
Variations on Night and Day,"Munif, Abdelrahman ",95290221,"Theroux, Peter",92000990,Pantheon,N,0,N,0,1993,USA,Arabic,1989,Lebanon,M,1,Syria,34.802075,38.996815,M,1,USA,37.09024,-95.712891,Novel,333,,Contents Page,N,0,-,-,-,0,-,0,-,0,-,0,0,-,-
Tales from Dayrut,"Mustagab, Mohamed",95290162,"Davies, Humphrey",228562256,AUC,Y,1,Y,1,2008,Egypt ,Arabic,"1983, 1984",Egypt,M,1,Egypt,26.820553,30.802498,M,1,Egypt,26.820553,30.802498,Novel,203,,"Introduction,   Author Bio,   Introduction,  Author Bio,   Translator Bio",Y (Notes),1,45,"Explanations, Qur'anic references etc. ",Quranic references,1,-,0,?,0,?,0,0,-,-
The Homeland,"Na'na, Hamida",46931854,"Asser, Martin",19575983,Garnet,N,0,Y,1,1995,UK,Arabic,1979,Lebanon,F,0,Syria,34.802075,38.996815,M,1,UK,55.378051,-3.435973,Novel,159,,"Contents Page,   Translator's Note,   Note on Quotation,   Author's Acknowledgements",N,0,-,-,-,0,-,0,-,0,-,0,0,-,-
Using Life,"Naji, Ahmed",11148120444594790369,"Koerber, Benjamin",98151352048552602141,UT Austin,Y,1,Y,1,2017,USA,Arabic,2014,Egypt,M,1,Egypt,26.820553,30.802498,M,1,USA,37.09024,-95.712891,Novel,196,,"Dedication,   Contents Page,  Epilogue,   Author Bio,   Translator Bio",N,0,-,-,-,0,-,0,-,0,-,0,0,PEN/Barbey Freedom to Write Award ,-
Gertrude,"Najmi, Hassan",244877856,"Allen, Roger",22256175,Interlink,N,0,Y,1,2013,USA,Arabic,2011,Morocco,M,1,Morocco,31.791702,-7.09262,M,1,USA,37.09024,-95.712891,Novel,270,,"Contents Page,   Author Bio,   Translator Bio,   Translator's Acknowledgements,   Translator's Introduction,   Author's Works,   Bibliography",N,0,-,-,-,0,-,0,-,0,-,0,0,-,-
Return to Dar al-Basha,"Nasr, Hassan",42093637,"Hutchins, William M.",12461356,Syracuse University Press,Y,1,Y,1,2006,USA,Arabic,1994,Tunisia,M,1,Tunisia,33.886917,9.537499,M,1,USA,37.09024,-95.712891,Novel,160,,Dedication,N,0,-,-,-,0,-,0,-,0,-,0,0,-,-
Flight Against Time,"Nasrallah, Emily",51768345,"Boullata, Issa J.",272292988,Ragweed Press,N,0,N,0,1987,Canada,Arabic,1981,Lebanon,F,0,Lebanon,33.854721,35.862285,M,1,Canada,56.130366,-106.346771,Novel,202,,"Introduction,   Dedication",N,0,-,-,-,0,-,0,-,0,-,0,0,-,-
Flight Against Time,"Nasrallah, Emily",51768345,"Boullata, Issa J.",272292988,Ragweed Press,N,0,Y,1,1997,Canada,Arabic,1981,Lebanon,F,0,Lebanon,33.854721,35.862285,M,1,Canada,56.130366,-106.346771,Novel,186,,"Preface,   Contents Page,   Notes",N,0,-,-,-,0,-,0,-,0,-,0,0,-,-
What Happened to Zeeko,"Nasrallah, Emily",51768345,"Johnson-Davies, Denys",75051071,Naufal,N,0,N,0,2015,Lebanon,Arabic,1997,Lebanon,F,0,Lebanon,33.854721,35.862285,M,1,Egypt,26.820553,30.802498,Novel,120,,"Glossary,   Translator's Foreword,   Introduction,   Translator Bio",N,0,-,-,-,0,-,0,-,0,-,0,0,IBBY Honor List 1998,
The Fantastic Strokes of Imagination,"Nasrallah, Emily",51768345,"Porteous, Rebecca",250829304,Elias ,N,0,Y,1,1995,Egypt ,Arabic,1984,Lebanon,F,0,Lebanon,33.854721,35.862285,F,0,Egypt,26.820553,30.802498,Short stories,89,,"Dedication,    postscript,   Contents Page",Y (Notes),1,-,,-,0,labneh,1,-,0,"mastaba, ibtisam",1,1,-,-
Inside the Night,"Nasrallah, Ibrahim",49386871,"Abbas, Bakr R. ",11682744,AUC,Y,1,Y,1,2007,Egypt,Arabic,1992,Lebanon,M,1,Jordan,30.585164,36.238414,M,1,-,,,Novel,182,,"Author Bio,   Translator Bio,   Book Reviews,   Contents Page,   Author's Preface,   Bibliography,   Glossary,  Notes",N,0,-,-,-,0,-,0,-,0,-,0,0,-,-
Prairies of Fever,"Nasrallah, Ibrahim",49386871,"Jayyusi, May & Reed, Jeremy","15007166, 92441683",Interlink,N,0,Y,1,1993,USA,Arabic,1985,Lebanon,M,1,Jordan,30.585164,36.238414,"F, M",-,"Israel, UK",32.0878504,34.7713073,Novel,154,,"Author Bio,   Translator Bio",Y (Notes),1,10,"Abu, dashdash, mutawwi, ustadh, mulukhiyya",mutawwi,1,mulukhiyya,1,dashdash,1,"abu, ustadh",1,0,-,-
The Lanterns of the King of Galilee: A Novel of 18th-Century Palestine,"Nasrallah, Ibrahim",49386871,"Roberts, Nancy",47001671,AUC,Y,1,Y,1,2015,Egypt,Arabic,1999,Lebanon,M,1,Jordan,30.585164,36.238414,F,0,USA,37.09024,-95.712891,Novel,544,,"Dedication,   Acknowledgements,   Author's Note,   Map,   Glossary,   Quotations,   Sources,   Footnotes",Y + Notes,1,53 (notes); 24 (glossary),"Notes - geographical explanations, historical notes about geography/empires/names of locations/customs, additions to the plot/characters' background that provide context",-,0,-,0,-,0,historical cultural explanations,1,1,-,-
Time of White Horses,"Nasrallah, Ibrahim",49386871,"Roberts, Nancy",47001671,Hoopoe,Y,1,Y,1,2016,Egypt,Arabic,2007,Lebanon,M,1,Jordan,30.585164,36.238414,F,0,"Amman, Jordan",31.9539494,35.910635,Novel,640,,None,Y (Notes),1,36,"bridal exchange, dalla, dhikr ceremony, fatiha, historical Lebanese/Arab figures, halawa, kinafa, maqluba, mulukhiya, qunbaz","dhikr ceremony, fatiha",1,"dalla, halawa, kinafa, maqluba, mulukhiya",1,qunbaz,1,bridal exchange,1,1,Shortlisted for 2009 International Prize for Arabic Fiction,-
Gaza Weddings,"Nasrallah, Ibrahim",49386871,"Roberts, Nancy",47001671,Hoopoe,Y,1,Y,1,2017,Egypt,Arabic,2004,Lebanon,M,1,Jordan,30.585164,36.238414,F,0,USA,37.09024,-95.712891,Novel,155,,"Author Bio,   Translator Bio",N,0,-,-,-,0,-,0,-,0,-,0,0,-,-
Land of No Rain,"Nasser, Amjad",69078789,"Wright, Jonathan",100760374,Bloomsbury Qatar,N,0,N,0,2014,Qatar,Arabic,2011,Lebanon,M,1,UK,55.378051,-3.435973,M,1,UK,55.378051,-3.435973,Novel,194,,"Contents Page,   Translator's Note,   Glossary",N,0,-,-,-,0,-,0,-,0,-,0,0,-,-
Nights of Musk ,"Oddoul, Haggag Hassan",59361227,"Calderbank, Anthony",97716024,AUC,Y,1,N,0,2005,Egypt,Arabic,2002,Egypt,M,1,Egypt,26.820553,30.802498,M,1,UK,55.378051,-3.435973,Short stories,119,,"Prologue,   Dedication,   Dedication,   Epilogue",Y,1,40,"Nubian terms, Arabic months, bango, bey, bismillah, fatiha, gallabiya, ibn, omda, uburty, al-Salaam, ya salaam","bismillah, al-Salaam",1,-,0,gallabiya,1,"Arabic months, bango, ibn, ya salaam",1,0,-,State Prize for Short Stories 1990
So You May See,"Prince, Mona",107787900,"Cohen, Raphael",82920405,AUC,Y,1,Y,1,2011,Egypt,Arabic,2008,Egypt,F,0,Egypt,26.820553,30.802498,M,1,Egypt,26.820553,30.802498,Novel,189,,"Map,   Dedication,   Author's Introduction",Y (Notes),1,1,Ibrahim al-Koni,-,0,-,0,-,0,-,0,1,-,-
Revolution is My Name,"Prince, Mona",107787900,"Mehrez, Samia",17550991,AUC,Y,1,Y,1,2014,Egypt,Arabic,2012,Egypt,F,0,Egypt,26.820553,30.802498,F,0,Egypt,26.820553,30.802498,Memoir,191,,Glossary,N,0,-,-,-,0,-,0,-,0,-,0,0,-,-
