The Call of the Curlew ,"Hussein, Taha",225088570,"As-Safi, A. B. ",286231578,Palm Press,N,0,N,0,1997,Egypt,Arabic,1934,Egypt,M,1,Egypt,26.820553,30.802498,M,1,Jordan,30.585164,36.238414,Novel,111,,"Translator's Introduction,   Introduction",N,0,-,-,-,0,-,0,-,0,-,0,0,-,-
The Sufferers,"Hussein, Taha",225088570,"El-Zayyat, Mona ",28777160,AUC,Y,1,N,0,1993,Egypt,Arabic,1955,Egypt,M,1,Egypt,26.820553,30.802498,F,0,-,,,Short stories,145,,Dedication,N,0,-,-,-,0,-,0,-,0,-,0,0,-,-
A Man of Letters,"Hussein, Taha",225088570,"El-Zayyat, Mona ",286231578,AUC,Y,1,N,0,1994,Egypt,Arabic,1935,Egypt,M,1,Egypt,26.820553,30.802498,F,0,-,,,Novel,140,,"Preface,   Dedication",N,0,-,-,-,0,-,0,-,0,-,0,0,-,-
The Tree of Misery,"Hussein, Taha",225088570,"El-Zayyat, Mona ",286231578,Palm Press,N,0,N,0,1997,Egypt,Arabic,1944,Egypt,M,1,Egypt,26.820553,30.802498,F,0,-,,,Novel,137,,"Contents Page,   Translator's Introduction,   Introduction",N,0,-,-,-,0,-,0,-,0,-,0,0,-,-
Down to the Sea,"Ibrahim, Gamil Atia",66630935,"Liardet, Frances",44578468,Quartet,N,0,N,0,1991,UK,Arabic,1986,Egypt,M,1,Switzerland,46.818188,8.227512,F,0,UK,55.378051,-3.435973,Novel,220,,"Introduction,   Author Bio,   Character List",N,0,-,-,-,0,-,0,-,0,-,0,0,-,-
Stealth,"Ibrahim, Sonallah",22217459,"Aboul-Ela, Hosam",11742620,Aflame Books,N,0,N,0,2009,UK,Arabic,2007,Egypt,M,1,Egypt,26.820553,30.802498,M,1,USA,37.09024,-95.712891,Novel,199,,"Translator's Introduction,   Glossary",Y,1,30,"amsheer, fatiha, gallabiya, mulukhiya, murta, oka, ubla",fatiha,1,mulukhiya,1,gallabiya ,1,amsheer,1,0,-,-
Zaat,"Ibrahim, Sonallah",22217459,"Calderbank, Anthony",97716024,AUC,Y,1,N,0,2001,UK,Arabic,1992,Egypt,M,1,Egypt,26.820553,30.802498,M,1,UK,55.378051,-3.435973,Novel,345,,"Afterword,   Author and Translator Bio",Y,1,53,"Abdel Haleem, Umm Kalsoum, bismillah, eid, hagg, halal, haram, kaaba, shariah, sunna, zakat, bastirma, bisaara, halawa, kofta, mezza, shawerma, taamiya, tirmis, higab, abla, afreet, allahu akbar, amm, effendim, al ahram, infitah, kohl, zaghrouda, ustaz, ya","bismillah, eid, hagg, halal, haram, kaaba, shariah, sunna, zakat",1,"bastirma, bisaara, halawa, kofta, mezza, shawerma, taamiya, tirmis",1,higab,1,"abla, afreet, allahu akbar, amm, effendim, al ahram, infitah, kohl, zaghrouda, ustaz, ya",1,1,-,-
That Smell and Notes from Prison,"Ibrahim, Sonallah",22217459,"Creswell, Robyn",107951509,New Directions,N,0,Y,1,2013,USA,Arabic,1966,Egypt,M,1,Egypt,26.820553,30.802498,M,1,USA,37.09024,-95.712891,Novel,91,,"Contents Page,   Translator's Introduction",N,0,-,-,-,0,-,0,-,0,-,0,0,-,-
Smell of it & Other Stories,"Ibrahim, Sonallah",22217459,"Johnson-Davies, Denys ",75051071,Heinemann,N,0,N,0,1971,UK,Arabic,1966,Egypt,M,1,Egypt,26.820553,30.802498,M,1,Egypt,26.820553,30.802498,Short stories,118,,"Glossary,   Acknowledgements,   Translator's Afterword",N,0,-,-,-,0,-,0,-,0,-,0,0,-,-
"Beirut, Beirut: A novel of love & war","Ibrahim, Sonallah",22217459,"Rossetti, Chip",256765349,Bloomsbury Qatar,N,0,N,0,2015,Qatar,Arabic,1988,Egypt,M,1,Egypt,26.820553,30.802498,M,1,USA,37.09024,-95.712891,Novel,332,,"Contents Page,   Quotation",Y,1,55,"green line, hamra street, ",-,0,"lebneh, tarbush, zaatar",1,"ghutra, hatta",1,"bey, blue bone, druze, Fairuz, fatah, fedayeen, fellah(a), sa'iqa, mourabitoun",1,1,-,-
The Committee ,"Ibrahim, Sonallah",22217459,"St. Germain, Mary & Constable, Charlene","23554220, 6739777",Syracuse University Press,Y,1,Y,1,2001,USA,Arabic,1981,Lebanon,M,1,Egypt,26.820553,30.802498,"F,F",0,"USA, Scotland",36.0431378,-79.8748196,Novel,158,,"Author's Acknowledgements,   Translator's Acknowledgements,  Translator's Note",N,0,-,-,-,0,-,0,-,0,-,0,0,-,-
Grandfather's Tale,"Idilbi, Ulfat",286959,"Clark, Peter",108191551,Quartet,N,0,N,0,1998,UK,Arabic,1991,Syria,F,0,Syria,34.802075,38.996815,M,1,UK,55.378051,-3.435973,Novel,217,,"Author Bio,   Translator Bio,   Translator's Foreword,   Author's Introduction",N,0,-,-,-,0,-,0,-,0,-,0,0,-,-
Sabriya: Damascus Bitter Sweet,"Idilbi, Ulfat",286959,"Clark, Peter ",108191551,Interlink,N,0,Y,1,1997,Canada,Arabic,1980,Syria,F,0,France,46.227638,2.213749,M,1,UK,55.378051,-3.435973,Novel,185,,"Author Bio,   Translator Bio,    series info,   Translator's Acknowledgements",Y,1,29,"Ma'ruf al-Arna'ut, banafsha, fetta makdus, mevlevi, Qais and Laila",mevlevi,1,"awwamat, fetta makdus, numara, zilif",1,"abaya, kaffiya, kubba, kunafa, ",1,"baha, banafsha, liwan",1,1,-,-
The Piper Dies and Other Stories,"Idris, Yousef",90716257,"Cohen-Mor, Dalya",97742631,Sheba Press,N,0,Y,1,1992,USA,Arabic,1965,Egypt,M,1,Egypt,26.820553,30.802498,F,0,USA,37.09024,-95.712891,Short stories,178,,"Contents Page,   Translator's Acknowledgements,   Translator's Introduction,   Footnotes",Y (Notes),1,15,-,-,0,-,0,-,0,-,0,0,-,-
Tales of Encounter,"Idris, Yusuf",90716257,"El-Enany, Rasheed",97601908,AUC,Y,1,Y,1,2012,Egypt,Arabic,"1958, 1959, 1980",Egypt,M,1,Egypt,26.820553,30.802498,M,1,UK,55.378051,-3.435973,Novellas,201,,"Translator's Note,   Translator's Introduction",Y,1,19,"historical Arab figures, dhikr circle, Fatiha, gallabiya, kuttab, maqam, shisha, Cairo geography, ya salaam!","dhikr circle, Fatiha",1,,,gallabiya,1,"kuttab, historical figures, maqam, shisha, Cairo geography, ya salaam!",1,1,-,-
A Leader of Men,"Idris, Yusuf",90716257,"Elkhadem, Saad",66508807,York,N,0,N,0,1988,Canada,Arabic,1987,Egypt,M,1,Egypt,26.820553,30.802498,M,1,Canada,56.130366,-106.346771,Novel,19,,"Contents Page,   Translator's Preface,   Footnotes,   Author and Translator Bio,   Bibliography",N,0,-,-,-,0,-,0,-,0,-,0,0,-,-
City of Love and Ashes,"Idris, Yusuf",90716257,"Hewison, R. Neil",39483851,AUC,Y,1,N,0,1999,Egypt,Arabic,1956,Egypt,M,1,Egypt,26.820553,30.802498,M,1,"Egypt, UK",30.0394077,31.2314328,Novel,166,,"Translator's Preface,    Arabic text",N,0,-,-,-,0,-,0,-,0,-,0,0,Naguib Mahfouz Medal (1998),-
The Essential Yusuf Idris: Masterpieces of the Egyptian Short Story,"Idris, Yusuf",90716257,"Johnson-Davies, Denys",75051071,AUC,Y,1,Y,1,2009,Egypt,Arabic,Misc.,Egypt,M,1,Egypt,26.820553,30.802498,M,1,Egypt,26.820553,30.802498,Short stories,264,,"Contents Page,   Translator's Afterword,   Glossary",Y (Notes),1,31,"al-Ghazaali, small Bairam, Quranic references, hagga, Sayyeda Zeinab, dhikr, kiblah, lailat al-qadr, ma'zun, sahour, wudu', mawlids, Dimirdash, melayas, mo'allem, days, zar, 'amm, siga, umm, abu, shaykh","small Bairam, Quranic references, hagga, Sayyeda Zeinab, dhikr, kiblah, lailat al-qadr, ma'zun, sahour, wudu', mawlids, Dimirdash",1,-,0,melayas,1,"mo'allem, days, zar, 'amm, siga, umm, abu, shaykh",1,1,-,-
The Sinners,"Idris, Yusuf",90716257,"Peterson-Ishaq, Kristin ",244982615,Three Continents,N,0,Y,1,1984,USA,Arabic,1959,Egypt,M,1,Egypt,26.820553,30.802498,F,0,USA,37.09024,-95.712891,Novel,113,,"Contents Page,   Introduction,   Footnotes",Y (Notes),1,unnumbered,-,-,0,-,0,-,0,-,0,0,-,-
The Cheapest Nights,"Idris, Yusuf",90716257,"Wassef, Wadida",248968736,Three Continents,N,0,N,0,1989,USA,Arabic,1954,Egypt,M,1,Egypt,26.820553,30.802498,F,0,Egypt,26.820553,30.802498,Short stories,196,,"Translator's Note,   Author Bio",Y (Notes),1,26,"Sheikha, shaddad, mashtah, mo'allem",shiekha,1,-,0,-,0,mo'allem,1,1,-,-
Whatever Happened to Antara?: And Other Stories ,"Ikhlassi, Walid",34611879,"Ellery, Chris & Sallah, Asmahan","54400434, 2723154",UT Austin,Y,1,N,0,2004,USA,Arabic,1992,Syria,M,1,Syria,34.802075,38.996815,"F, M",-,USA,37.09024,-95.712891,Short stories,115,,"Contents Page,   Translator's Acknowledgements,   Translator's Introduction,   Footnotes,    Interview with the Author",Y (Notes),1,8,"wadudiah, al madaa’h an-nabawiya, sheikha, Antara","wadudiah, al madaa’h an-nabawiya",1,-,0,-,0,"sheikha, Antara",1,1,-,-
The Mehlis Report,"Jaber, Rabee",76478706,"Abu-Zeid, Kareen James",-,New Directions,N,0,Y,1,2013,USA,Arabic,2005,Lebanon,M,1,Lebanon,33.854721,35.862285,M,1,USA,37.09024,-95.712891,Novel,202,,Dedication,N,0,-,-,-,0,-,0,-,0,-,0,0,International Arabic Fiction Prize 2012,-
Confessions,"Jaber, Rabee",76478706,"Abu-Zeid, Kareen James",-,New Directions,N,0,Y,1,2016,USA,Arabic,2008,Lebanon,M,1,Lebanon,33.854721,35.862285,M,1,USA,37.09024,-95.712891,Novel,120,,Dedication,N,0,-,-,-,0,-,0,-,0,-,0,0,International Prize for Arabic Fiction,-
Hunters in a Narrow Street ,"Jabra, Jabra Ibrahim",2436078,"Allen, Roger",22256175,Three Continents,N,0,N,0,1990,USA,Arabic,1990,Lebanon,M,1,Iraq,33.223191,43.679291,M,1,USA,37.09024,-95.712891,Novel,227,,Translator's Introduction,N,0,-,-,-,0,-,0,-,0,-,0,0,-,-
The Ship,"Jabra, Jabra Ibrahim",2436078,"Allen, Roger & Haydar, Adnan","22256175, 69043114",Three Continents,N,0,Y,1,1985,USA,ِArabic,1969,Egypt,M,1,Iraq,33.223191,43.679291,"M,M",1,USA,37.09024,-95.712891,Novel,198,,"Author Bio,   Translator Bio,   Contents Page,   Translator's Afterword",N,0,-,-,-,0,-,0,-,0,-,0,0,-,-
In Search of Walid Masoud,"Jabra, Jabra Ibrahim",2436078,"Allen, Roger & Haydar, Adnan","22256175, 69043114",Syracuse University Press,Y,1,Y,1,2000,USA,Arabic,1978,Lebanon,M,1,Iraq,33.223191,43.679291,"M,M",1,USA,37.09024,-95.712891,Novel,289,,"Dedication,    Note on the Translation,   Contents Page,   Author's Introduction",N,0,-,-,-,0,-,0,-,0,-,0,0,-,-
The First Well: A Bethlehem Boyhood,"Jabra, Jabra Ibrahim",2436078,"Boullata, Issa",272292988,University of Arkansas Press,Y,1,Y,1,1995,USA,Arabic,1987,UK,M,1,Iraq,33.223191,43.679291,M,1,Palestine,31.952162,35.233154,Memoir,184,,"Dedication,   Quotation,   Author and Translator Bio,   Contents Page",Y (Notes),1,8,author's footnotes,-,0,-,0,-,0,-,0,0,-,-
Princesses' Street: Baghdad Memories,"Jabra, Jabra Ibrahim",2436078,"Boullata, Issa",272292988,University of Arkansas Press,Y,1,Y,1,2005,USA,Arabic,1994,Lebanon,M,1,Iraq,33.223191,43.679291,M,1,Palestine,31.952162,35.233154,Memoir,183,,"Translator's Preface,   Translator's Note,   Author's Preface,   Footnotes",Y (Notes),1,10,"biographical notes, translations of untranslated words, author clarifications, Desert Storm",-,0,-,0,-,0,-,0,1,-,-
The Journals of Sarab Affan,"Jabra, Jabra Ibrahim",2436078,"Nasr, Ghassan",26497946,Syracuse University Press,Y,1,Y,1,2007,USA,Arabic,1992,Lebanon,M,1,Iraq,33.223191,43.679291,M,1,USA,37.09024,-95.712891,Novel,188,,"Dedication,   Translator's Preface,   Author's Preface,   Introduction,   Footnotes",N,0,-,-,-,0,-,0,-,0,-,0,0,-,-
The American Granddaughter,"Kachachi, Inaam",3622234,"Youssef, Nariman",47152501067110680511,Bloomsbury Qatar,N,0,N,0,2010,Qatar,Arabic,2008,Lebanon,F,0,France,46.227638,2.213749,F,0,UK,55.378051,-3.435973,Novel,180,,"Dedication,   Quotation,   Glossary,   Translator Bio",Y,1,40,"afreet, jeonky, mahjar poets, mejaddareh, sayyab, teshrib, yaaba, oud, tabla, bismallah, hadith, hajja, mujahid, dolma, mejaddareh, masgoof, shawermeh, tabouleh, teshrib, abaya, dishdasha, galabiyya","bismallah, hadith, hajja, mujahid",1,"dolma, mejaddareh, masgoof, shawermeh, tabouleh, teshrib",1,"abaya, dishdasha, galabiyya",1,"afreet, jeonky",1,1,Shortlisted for 2009 International Prize for Arabic Fiction,-
Cigarette Number Seven,"Kamal, Donia",157525678,"Youssef, Nariman",47152501067110680511,Hoopoe (imprint of AUC press),Y,1,Y,1,2018,Egypt,Arabic,2012,Egypt,F,0,Egypt,26.820553,30.802498,F,0,"Egypt, UK",30.0394077,31.2314328,Novel,191,,"Author Bio,   Translator Bio,   Dedication",N,0,-,-,-,0,-,0,-,0,-,0,0,-,-
All That's Left to You,"Kanafani, Ghassan",39379118,"Jayyusi, May & Reed, Jeremy","15007166, 92441683",Interlink,N,0,Y,1,2004,USA,Arabic,1966,Lebanon,M,1,Palestine,31.952162,35.233154,"M,F",-,"Israel, UK",32.0878504,34.7713073,"Novella, Short stories",128,,"Contents Page,   Acknowledgements,   Translator's Introduction,   Map",N,0,-,-,-,0,-,0,-,0,-,0,0,-,-
Men in the Sun,"Kanafani, Ghassan",39379118,"Kilpatrick, Hilary",41953129,Three Continents,N,0,N,0,1991,USA,Arabic,"1956, 1958, 1961, 1962, 1969",Misc.,M,1,Palestine,31.952162,35.233154,F,0,Switzerland,46.818188,8.227512,Short stories,90,,"Acknowledgements,   Introduction,    A Clarification",N,0,-,-,-,0,-,0,-,0,-,0,0,-,-
The Seven Days of Man,"Kassem, Abdel-Hakim",169031,"Norment Bell, Joseph",93463990,Hydra Books (Northwestern University Press),Y,1,Y,1,1996,USA,Arabic,1969,Egypt,M,1,Egypt,26.820553,30.802498,M,1,USA,37.09024,-95.712891,Novel,218,,"Contents Page,   Quotation,   Foreword,   Translator's Preface",N,0,-,-,-,0,-,0,-,0,-,0,0,-,-
African Titanics,"Khaal, Abu Bakr",297715327,"Bredin, Charis",31150516737003442945?,Darf,N,0,Y,1,2017,UK,Arabic,2008,Lebanon,M,1,"Denmark, Eritrea",,,F,0,UK,55.378051,-3.435973,Novel,119,,"Dedication,   Author Bio",N,0,-,-,-,0,-,0,-,0,-,0,0,-,-
Throwing Sparks,"Khal, Abdo",20905810,"Tabet, Maia & Scott, Michael K. ","107330618, 311467158",Bloomsbury Qatar,N,0,N,0,2015,Qatar,Arabic,2009,Lebanon,M,1,Saudi Arabia,23.885942,45.079162,"F,M",-,USA,37.09024,-95.712891,Novel,349,,"Quotation,   Author Bio",N,0,-,-,-,0,-,0,-,0,-,0,0,International Prize for Arabic Fiction 2010,-
The Magic of Turquoise,"Khaled, Mai",2724690,"Elnaggar, Marwa",250939617,AUC,Y,1,Y,1,2011,Egypt,Arabic,2006,Egypt,F,0,Egypt,26.820553,30.802498,F,0,USA,37.09024,-95.712891,Novel,98,,None,N,0,-,-,-,0,-,0,-,0,-,0,0,-,-
In Praise of Hatred,"Khalifa, Khaled",172894016,"Price, Leri ",296358690,Thomas Dunne Books (St. Martin's Press),N,0,N,0,2014,USA,Arabic,2008,Lebanon,M,1,Syria,34.802075,38.996815,F,0,UK,55.378051,-3.435973,Novel,296,,"Dedication,   Contents Page,   Character List,   Afterword,   Translator's Note,   Author Bio,   Translator Bio",N,0,-,-,-,0,-,0,-,0,-,0,0,Shortlisted for the International Prize for Arabic Fiction in 2008 ,-
No Knives in the Kitchens of This City,"Khalifa, Khaled",172894016,"Price, Leri ",296358690,Hoopoe,Y,1,Y,1,2016,USA,Arabic,2013,Egypt,M,1,Syria,34.802075,38.996815,F,0,UK,55.378051,-3.435973,Novel,215,,"Author and Translator Bio,   Author's Acknowledgements,   Notes",Y (Notes),1,4,"Hamid Badrkhan, Orhan Misar etc (names of artists and writers)",-,0,-,0,-,0,-,0,1,Naguib Mahfouz Medal,-
The Shell,"Khalifa, Mustafa",61868122,"Starkey, Paul",116022327,Interlink,N,0,Y,1,2016,USA,Arabic,2006,Lebanon,M,1,Syria,34.802075,38.996815,M,1,UK,55.378051,-3.435973,Novel,252,,None,N,0,-,-,-,0,-,0,-,0,-,0,0,-,-
The Inheritance,"Khalifa, Sahar ",14801041,"Bamia, Aida",44525532,AUC,Y,1,N,0,2005,Egypt,Arabic,1997,Lebanon,F,0,"Jordan, Palestine",31.974227,35.9072911,F,0,USA,37.09024,-95.712891,Novel,251,,"Translator's Note,   Glossary",Y,1,80,"Avicenna, awwameh, fidai, kirdan, mansaf, qazha, tabliyeh, zunud al-sitt","adhan, dhikr, al-fatiha, hajj, khatma, madhahib, mashallah, salam, shari'a, shubbayk, lubbayk, Sunna, tarawih, 'umra, waqf",1,"araq, awwameh, balouza, bisarah, falafel, ful, ka'ek, knafeh, mahaleb, mansaf, msakhkhan, mulukhiya, qazha, shawirma, tabbouleh, tamriyeh, za'tar, zunud al-sitt",1,"kirdan, kufiyeh, tarbush",1,"bushaq, dabkeh, diwan, dunum, Fairuz, fidai, haq, qirat, sitt, tabliyeh, Umm Kulthum, ya",1,1,-,-
"The Image, the Icon, and the Covenant","Khalifeh, Sahar ",14801041,"Bamia, Aida",44525532,Interlink,N,0,Y,1,2008,USA,Arabic,2002,Lebanon,F,0,"Jordan, Palestine",31.974227,35.9072911,F,0,USA,37.09024,-95.712891,Novel,264,,"Quotation,   Glossary",Y,1,25,"wali, arak, knafeh, mahaleb, tabbuleh, egal, ghutra, hatta, kufiyyeh, kumbaz, serwal, dabkeh, dal'uneh, fida'i, habibi, mashrabiya, oud, qanun, ustadh, ya",wali,1,"arak, knafeh, mahaleb, tabbuleh",1,"egal, ghutra, hatta, kufiyyeh, kumbaz, serwal",1,"dabkeh, dal'uneh, fida'i, habibi, mashrabiya, oud, qanun, ustadh, ya",1,0,Naguib Mahfouz Medal for Literature 2006,-
Of Noble Origins ,"Khalifeh, Sahar ",14801041,"Bamia, Aida",44525532,AUC,Y,1,Y,1,2012,Egypt,Arabic,2009,Lebanon,F,0,"Jordan, Palestine",31.974227,35.9072911,F,0,USA,37.09024,-95.712891,Novel,269,,Author Bio,Y,1,68,"Basmala, dunums, maddahin, nuqut, qatayif, tamriyeh, zawiyas","adhan, basmala, bismillah, buraq, the Companions, ediyyeh, hadra, al-Hasan and al-Husayn, katb al-kitab, the maryam sura, ma sha'allah, mawalid, ",1,"belila, faqqus, fatteh, kaak, knafeh, kubbeh, maamul, mahlab, mansaf, mushabbak, ",1,"abayeh, baraqi, ",1,"awqaf, kanoun, maqam, ",1,1,-,-
The End of Spring,"Khalifeh, Sahar ",14801041,"Haydar, Paula",7665444,Interlink,N,0,Y,1,2008,USA,Arabic,2004,Lebanon,F,0,Palestine,31.952162,35.233154,F,0,USA,37.09024,-95.712891,Novel,281,,"Contents Page,   Notes,   Acknowledgements",Y (Notes),1,47,"waaf, hajji, mihrab, fatiha, ya layl, shahada, halwa, ghazl-il-banat, knafeh, fattoosh, meze, lebneh, kibbeh, msakhkhan, sambousek, salata, za'atar, serwal, nakba, tanzims, dabke, haati, mukhtar, mawwal, qanun, aziza, mujahid","waaf, hajji, mihrab, fatiha, ya layl, shahada, ",1,"halwa, ghazl-il-banat, knafeh, fattoosh, meze, lebneh, kibbeh, msakhkhan, sambousek, salata, za'atar",1,serwal,1,"nakba, tanzims, dabke, haati, mukhtar, mawwal, qanun, aziza, mujahid",1,0,-,-
Wild Thorns,"Khalifeh, Sahar ",14801041,"Le Gassik, Trevor & Fernea, Elizabeth",109193814??,Interlink,N,0,Y,1,1989,USA,Arabic,1976,Israel ,F,0,"Jordan, Palestine",31.974227,35.9072911,"M, F",-,"UK, Canada",51.5078,-0.129097,Novel,202,,Glossary,N,0,-,-,-,0,-,0,-,0,-,0,0,-,-
A Sky So Close,"Khedairi, Betool",81658095,"Muhayman, Jamil",10155788,Anchor,N,0,N,0,2002,USA,Arabic,1999,Lebanon,F,0,Jordan,30.585164,36.238414,M,1,UK,55.378051,-3.435973,Novel,238,,"Dedication,   Author's Acknowledgements",N,0,-,-,-,0,-,0,-,0,-,0,0,-,-
Absent,"Khedairi, Betool",81658095,"Muhayman, Jamil",10155788,AUC,Y,1,N,0,2005,USA,Arabic,2004,Lebanon,F,0,Jordan,30.585164,36.238414,M,1,UK,55.378051,-3.435973,Novel,211,,"Author Bio,   Dedication,   Acknowledgements",N,0,-,-,-,0,-,0,-,0,-,0,0,-,-
As Though She Were Sleeping,"Khoury, Elias ",14792508,"Booth, Marilyn",14901543,Archipelago Books,N,0,Y,1,2012,USA,Arabic,2007,Lebanon,M,1,Lebanon,33.854721,35.862285,F,0,USA,37.09024,-95.712891,Novel,361,,"Author Bio,   Quotation",N,0,-,-,-,0,-,0,-,0,-,0,0,-,-
Gate of the Sun,"Khoury, Elias ",14792508,"Davies, Humphrey",228562256,Archipelago Books,N,0,Y,1,2006,USA,Arabic,1998,Lebanon,M,1,Lebanon,33.854721,35.862285,M,1,UK,55.378051,-3.435973,Novel,528,,"Quotation,   Translator's Note",Y (Notes),1,11,"kunafa, historical events, Abd Al-Qadir Husseini, al-Mutanabbi, UNWRA, intifada",-,0,kunafa,1,-,0,"historical events, Abd Al-Qadir Husseini, al-Mutanabbi, UNWRA, intifada",1,1,-,-
Broken Mirrors: Sinalcol,"Khoury, Elias ",14792508,"Davies, Humphrey",228562256,Archipelago Books,N,0,Y,1,2016,USA,Arabic,2012,Lebanon,M,1,Lebanon,33.854721,35.862285,M,1,UK,55.378051,-3.435973,Novel,492,,"Contents Page,   Foreword,    Maps",N,0,-,-,-,0,-,0,-,0,-,0,0,-,-
Gates of the City,"Khoury, Elias ",14792508,"Haydar, Paula",7665444,University of Minnesota Press,Y,1,Y,1,1993,USA,Arabic,1981,Lebanon,M,1,Lebanon,33.854721,35.862285,F,0,USA,37.09024,-95.712891,Novel,94,,"Author Bio,   Book Reviews,    Maps,   Footnotes",Y (Notes),1,-,-,-,0,-,0,-,0,-,0,0,-,-
The Kingdom of Strangers,"Khoury, Elias ",14792508,"Haydar, Paula",7665444,University of Arkansas Press,Y,1,Y,1,1996,USA,Arabic,1993,Lebanon,M,1,Lebanon,33.854721,35.862285,F,0,USA,37.09024,-95.712891,Novel,103,,"Quotation,   Prologue",N,0,-,-,-,0,-,0,-,0,-,0,0,-,-
The Journey of Little Ghandi,"Khoury, Elias ",14792508,"Haydar, Paula",7665444,University of Minnesota Press,Y,1,Y,1,2009,USA,Arabic,1989,Lebanon,M,1,Lebanon,33.854721,35.862285,F,0,USA,37.09024,-95.712891,Novel,194,,"Contents Page,   Foreword,   Notes,   Author and Translator Bio",Y (Notes),1,9,"Beirut geography/history, labneh, historical figures, fatiha, kabbout",fatiha,1,labneh,1,kabbout,1,Beirut geography/history,1,1,-,-
Little Mountain,"Khoury, Elias ",14792508,"Tabet, Maia",107330618,University of Minnesota Press,Y,1,Y,1,1989,USA,ِArabic,1977,Lebanon,M,1,Lebanon,33.854721,35.862285,F,0,USA,37.09024,-95.712891,Novel,140,,Quotation,Y (Notes),1,unnumbered,-,-,0,-,0,-,0,-,0,0,-,-
White Masks,"Khoury, Elias ",14792508,"Tabet, Maia",107330618,Archipelago Books,N,0,Y,1,2010,USA,Arabic,1981,Lebanon,M,1,Lebanon,33.854721,35.862285,F,0,USA,37.09024,-95.712891,Novel,288,,"Dedication,   Translator's Dedication,   Foreword,   Footnotes,   Author Bio,    Foreword,  Author Bio,   Translator Bio",Y (Notes),1,unnumbered,"Explanations, definitions like - Al-Kata'eb ",-,0,-,0,-,0,-,0,0,-,-
Yalo,"Khoury, Elias ",14792508,"Theroux, Peter",92000990,Picador,N,0,Y,1,2009,USA,Arabic,2002,Lebanon,M,1,Lebanon,33.854721,35.862285,M,1,USA,37.09024,-95.712891,Novel,360,,Preface,N,0,-,-,-,0,-,0,-,0,-,0,0,-,-
Basrayatha,"Khudayyir, Mohammed",107038527,"Hutchins, William M.",12461356,AUC,Y,1,Y,1,2007,Egypt,Arabic,1996,Iraq,M,1,Iraq,33.223191,43.679291,M,1,USA,37.09024,-95.712891,Novel,151,,"Translator's Acknowledgements,   Contents Page,   Quotation,   Glossary,    note on the epigraphs",Y,1,19,"Buwayb, Jaykur, ",-,0,-,0,-,0,"abudhiya, mizmar, mubattil, muhtasib, qanun, qasab, rabab, shami, sidr, slubi, thamud, zanj",1,1,-,-
Halima,"Laroussi El Metoui, Muhammad",207808294,"Boujmil, Hafdeh",-,Nirvana,N,0,N,0,2018,Tunisia,Arabic,1961,Tunisia,M,1,Tunisia,33.886917,9.537499,M,1,Tunisia,33.886917,9.537499,Novel,91,,"Dedication,   Contents Page,   Translator's Foreword,   Introduction,   Glossary,   Bibliography",Y,1,30,-,-,0,-,0,"ahram, ajar, akhras, benoir, bekhnoug, dhabbah, futa and bluza, hezam, hossara, khashabia, ketfia, khulkhal, khuyut, kmija, safsari",1,"awada, wedding customs",1,0,-,-
Al-Rahman Tree: The Story of Al-Waq El-Waq Islands' Embracement of Islam,"Madfaay, Walid",244177465,"Shihabi, Ibraheem Yahya",75251046,Maldives,N,0,-,0,1999,USA,Arabic,1996,Syria,M,1,Syria,34.802075,38.996815,M,1,Syria,34.802075,38.996815,Novel,288,,"Summary,   Author's Introduction,   Dedication,   Translator's Foreword,   Footnotes",Y (Notes),1,198,"al-rahman, hadith, Quranic references, al-sahar, al-suhur, jamid, khulkhal, mursala, qilada, istikana, old Arabic words","al-rahman, hadith, Quranic references, al-sahar, al-suhur",1,jamid,1,"khulkhal, mursala, qilada",1,"istikana, old Arabic words",1,1,-,-
Akhenaten: Dweller in Truth,"Mahfouz, Naguib",89803944,"Abu-Hassabo, Tagreid",53488077,Anchor,N,0,N,0,1998,USA,Arabic,1985,Egypt,M,1,Egypt,26.820553,30.802498,F,0,USA,37.09024,-95.712891,Novel,168,,Translator's Afterword,N,0,-,-,-,0,-,0,-,0,-,0,0,,
Mirrors,"Mahfouz, Naguib",89803944,"Allen, Roger",22256175,Bibliotheca Islamica,N,0,N,0,1977,Maldives,Arabic,1972,Egypt,M,1,Egypt,26.820553,30.802498,M,1,USA,37.09024,-95.712891,Novel,277,,"Translator's Introduction,   Map",Y (Notes),1,79,"the national party, abbasiyya, umda, as sakakini, khan al khalili, al fayyum, mihrab, ibn kalb, shatbi",mihrab,1,-,0,-,0,"the national party, abbasiyya, umda, as sakakini, khan al khalili, al fayyum, ibn kalb, shatbi",1,1,-,-
Autumn Quail,"Mahfouz, Naguib",89803944,"Allen, Roger",22256175,AUC,Y,1,N,0,1985,Egypt,Arabic,1962,Egypt,M,1,Egypt,26.820553,30.802498,M,1,USA,37.09024,-95.712891,Novel,132,,"Foreword,   Author Bio",Y (Notes),1,49,"ala kaifak, clear destruction, colocynth, faqih, khamsin, sufism, wafd, zizinia, ful, gallabiyya, al-hajj(a)","faqih, al-hajj(a), sufism",1,"colocynth, ful",1,gallabiyya,1,"wafd, zizinia",1,1,-,-
Mirrors,"Mahfouz, Naguib",89803944,"Allen, Roger",22256175,Zeitouna ,N,0,N,0,1999,Egypt,Arabic,1972,Egypt,M,1,Egypt,26.820553,30.802498,M,1,USA,37.09024,-95.712891,Novel,174,,"Author Bio,   Translator's Afterword,   Glossary",N,0,-,-,-,0,-,0,-,0,-,0,0,-,-
Karnak Cafe,"Mahfouz, Naguib",89803944,"Allen, Roger",22256175,AUC,Y,1,N,0,2007,Egypt,Arabic,1974,Egypt,M,1,Egypt,26.820553,30.802498,M,1,USA,37.09024,-95.712891,Novel,99,,Introduction,N,0,-,-,-,0,-,0,-,0,-,0,0,,
The Final Hour,"Mahfouz, Naguib",89803944,"Allen, Roger",22256175,AUC,Y,1,Y,1,2010,Egypt,Arabic,1982,Egypt,M,1,Egypt,26.820553,30.802498,M,1,USA,37.09024,-95.712891,Novel,163,,"Author and Translator Bio,   Glossary,   Translator's Acknowledgements",Y,1,28,"1923 Constitution, basmallah, infitah, Mustafa al-Nahhas, Suez 1956, Socialist laws, Yemen Revolution (mostly historical explanations)",basmallah,1,-,0,-,0,"1923 Constitution, infitah, Mustafa al-Nahhas, Suez 1956, Socialist laws, Yemen Revolution",1,1,-,-
Khan Al-Khalili ,"Mahfouz, Naguib",89803944,"Allen, Roger",22256175,Anchor,N,0,Y,1,2011,USA,Arabic,1946,Egypt,M,1,Egypt,26.820553,30.802498,M,1,USA,37.09024,-95.712891,Novel,374,,"Note on the Arabic Alphabet,   Glossary,   Translator's Note",Y,1,58,"Abd al-Hayy, al-Alamein, dab'a, hanbali, al-jahiz, night of power, zar, eid al-fitr, eid al-adha, laylat al-qadr, shaaban, shahada, zar, ful mudammis, kunafa, gallabiya, jubba, taamiya, farsi, naskh, ruq'a, thuluth, hanem, mahmal, shisha, sitt, Umm Kulthum","eid al-fitr, eid al-adha, laylat al-qadr, shaaban, shahada, zar",1,"ful mudammis, kunafa",1,"gallabiya, jubba, taamiya",1,"farsi, naskh, ruq'a, thuluth, hanem, mahmal, shisha, sitt, Umm Kulthum",1,1,-,-
"Mahfouz Centennial Library Volume 12: Mirrors, Love in the Rain, Karnak Cafe","Mahfouz, Naguib",89803944,"Allen, Roger & Roberts, Nancy",,AUC,Y,1,N,0,2011,Egypt,Arabic,"1999, 1973, 1974",Egypt,M,1,Egypt,26.820553,30.802498,"M, F, M",-,"USA, USA, USA",37.09024,-95.712891,Novel,410,,"Contents Page,   Introduction,   Bibliography,   Chronology,   Editor's Acknowledgements,   Translator's Acknowledgements",N,0,-,-,-,0,-,0,-,0,-,0,0,,
Heart of the Night,"Mahfouz, Naguib",89803944,"Bamia, Aida",44525532,AUC,Y,1,Y,1,2011,Egypt,Arabic,1975,Egypt,M,1,Egypt,26.820553,30.802498,F,0,USA,37.09024,-95.712891,Novel,99,,Contents Page,Y,1,16,,"laylat al-qadr, mahmal, salafi, ",1,"fuul, kawari, ",1,"gallabiya, gibba, quftan",1,"awalim, salamlik, samadiya, suradiq, tawashih, tuzz, waqf",1,0,-,-
Rhadopis of Nubia,"Mahfouz, Naguib",89803944,"Calderbank, Anthony ",97716024,AUC,Y,1,N,0,2003,Egypt,Arabic,1943,Egypt,M,1,Egypt,26.820553,30.802498,M,1,UK,55.378051,-3.435973,Novel,185,,"Introduction,   A Note on Transliteration,   Bibliography,   Glossary",N,0,-,-,-,0,-,0,-,0,-,0,0,-,-
