Sarmada,"Azzam, Fadi",183660502,"Talib, Adam ",107469046,Interlink,N,0,Y,1,2012,USA,Arabic,2011,Lebanon,M,1,UAE,23.424076,53.847818,M,1,UK,55.378051,-3.435973,Novel,216,,"Contents Page,   Author Bio",N,0,-,-,-,0,-,0,-,0,-,0,0,Longlisted for International Prize for Arabic Fiction 2012,-
Ascension to Death,"Azzam, Mamdouh",64248725,"Weiss, Max ",107347284,Haus Publishing,N,0,Y,1,2018,UK,Arabic,2009,Syria,M,1,Syria,34.802075,38.996815,M,1,USA,37.09024,-95.712891,Novel,117,,"Author Bio,   Quotation",N,0,-,-,-,0,-,0,-,0,-,0,0,-,-
Papa Sartre,"Bader, Ali",66773228,"Bamia, Aida ",44525532,AUC,Y,1,Y,1,2009,Egypt,Arabic,2001,Lebanon,M,1,Belgium,50.503887,4.469936,F,0,USA,37.09024,-95.712891,Novel,178,0,None,N,0,-,-,-,0,-,0,-,0,-,0,0,"State Prize for Literature (Baghdad, 2002)",
The Tobacco Keeper,"Bader, Ali",66773228,"Nowaira, Amira ",33910649,Bloomsbury Qatar,N,0,N,0,2011,Qatar,Arabic,2008,Lebanon,M,1,Belgium,50.503887,4.469936,F,0,Egypt,26.820553,30.802498,Novel,328,,Translator Bio,N,0,-,-,-,0,-,0,-,0,-,0,0,Longlisted for the International Prize for Arabic Fiction (2009),-
A Balcony Over the Fakihani ,"Badr, Liana",36993851,"Clark, Peter & Tingley, Christopher","108191551, 61676886",Interlink,N,0,Y,1,1993,USA,Arabic,1983,Lebanon,F,0,Palestine,31.952162,35.233154,"M, M",1,"UAE, UK",25.3250773,55.5026636,Novella,127,,"Translator's Acknowledgements,   Translator's Note",N,0,-,-,-,0,-,0,-,0,-,0,0,-,-
A Compass for the Sunflower,"Badr, Liana",36993851,"Cobham, Catherine ",24756669,The Women's Press,N,0,Y,1,1989,UK,Arabic,1979,Lebanon,F,0,Palestine,31.952162,35.233154,F,0,UK,55.378051,-3.435973,Novel,119,,"Introduction,   Glossary,   Dedication,   Author Bio,   Introduction,  Author Bio,   Translator Bio",N,0,-,-,-,0,-,0,-,0,-,0,0,-,-
The Eye of the Mirror,"Badr, Liana",36993851,"Kawar, Samira ",31897185,Garnet,N,0,Y,1,1994,UK,Arabic,1991,Morocco,F,0,Palestine,31.952162,35.233154,F,0,UK,55.378051,-3.435973,Novel,264,,"Contents Page,   Introduction,   Translator Bio",Y,1,38,"Historical Lebanese/Palestinian figures/groups (Ahrar, PLO, etc), amti, arak, culpac, Hajjeh, khalti, khanfeh, Khawajah","hajjeh, ",1,"arak, knafeh, kubbeh, labaneh, ma'moul, mezza, mujaddarah, muloukhiyah",1,culpac,1,"amti, arghoul, dastour, haganah, khalti, khawajah, mijwez, sha'rawiya, ustath, yaba, yamma",1,1,-,-
Voices of Change: Short Stories by Saudi Arabian Women Writers,"Bagader, Abubaker and Heinrichsdorff, Ava M. and Akers, Deborah S. (editors and translators); misc. authors",54304494,"Bagader, Abubaker & Heinrichsdorff, Ava M. & Akers, Deborah S. & Al-Sebail, Abdul-Aziz","54304494, 71549832, 118672308, 37071661",Lynne Rienner,N,0,Y,1,1998,USA,Arabic,Misc.,Misc.,F,0,Saudi Arabia,23.885942,45.079162,"M, F",-,"USA, Saudi Arabia",38.9013301,-77.2240457,Short stories,142,,"Dedication,   Contents Page,    Editor's preface,   Editor's Introduction,   Editor's Note,   Endnotes,   Glossary,   Author Bio,    About the Book",Y,1,43 (endnotes); 44 (glossary),"al-fatihah, Qoranic references, daily prayers, hajj, allah, hadith, 'id, ilhamdillah, inshallah, muezzin, saffron, fisfis, fitayer, abayah, thobe, dishdasha, ghutra, igal, marriage customs, household customs, gender customs, education, mahram, mashrabiyyat","al-fatihah, Qoranic references, daily prayers, hajj, allah, hadith, 'id, ilhamdillah, inshallah, muezzin",1,"saffron, fisfis, fitayer",1,"abayah, thobe, dishdasha, ghutra, igal",1,"marriage customs, household customs, gender customs, education, mahram, mashrabiyyat",1,0,-,-
The Golden Chariot,"Bakr, Salwa ",37058136,"Manisty, Dinah ",9745935,Garnet,N,0,Y,1,1995,UK,Arabic,1991,Egypt,F,0,Egypt,26.820553,30.802498,F,0,UK,55.378051,-3.435973,Novel,191,,Translator's Note,N,0,-,-,-,0,-,0,-,0,-,0,0,-,-
The Golden Chariot,"Bakr, Salwa ",37058136,"Manisty, Dinah ",9745935,AUC,Y,1,Y,1,2008,Egypt,Arabic,1991,Egypt,F,0,Egypt,26.820553,30.802498,F,0,UK,55.378051,-3.435973,Novel,191,,"Translator's Acknowledgements,   Preface,   Sources Page,   Glossary,   Quotation,    Coptic Miths and their Gregorian Equivalents",N,0,-,-,-,0,-,0,-,0,-,0,0,-,-
The Man from Bashmour,"Bakr, Salwa ",37058136,"Roberts, Nancy ",47001671,AUC,Y,1,Y,1,2007,Egypt,Arabic,1998,Egypt,F,0,Egypt,26.820553,30.802498,F,0,USA,37.09024,-95.712891,Novel,297,,"Introduction,   Translator's Note,   Author Bio,   Translator Bio",Y,1,96,"am'at, arianism, basta, dalnis, dummaz, faludhaj, haydar, kardah, mizhar, nida, qandil, sekanjabin, tahouti, whiba, zawiya, zirbaj","dawsa, indimansi, majdhub, qarun, subhan allah, tarawih prayers, tharid, zawiya",1,"faludhaj, fuqqa', kammuniya, khashkananj, kishk, ma'muniya, nida, qandil, safidhabaja, sekanjabin, zirbaj",1,"abaya, jubba",1,"am'at, anubis, ardab, dalnis, dinar, dummaz, feddan, isba', jizya, kemet, kharaj, mizhar, mizmar, qanun, rebab, tannour, tunbur, uqiya",1,1,-,Commendation - 2008 Banipal Prize 
The Crane,"Barakat, Halim ",36939376,"Frangieh, Bassam & Allen, Roger ","28219068, 22256175",AUC,Y,1,Y,1,2008,Egypt,Arabic,1988,Egypt,M,1,USA,37.09024,-95.712891,"M, M",1,"USA, USA",37.09024,-95.712891,Novel,147,,"Contents Page,   Image,   Poem,   Introduction,   Translator's Foreword",Y,1,30,"sura of the ant, arak, ful, hummus, kibbeh, kishik, malban, mezze, mujadara, mutabala, shanklish, tabouleh, sirwal, ataba, dabka, dal'una, jinns, ma'anna, mankala, mijana, nay, oud, al-Salaamu 'alaykum, zajal",sura of the ant,1,"arak, ful, hummus, kibbeh, kishik, malban, mezze, mujadara, mutabala, shanklish, tabouleh",1,sirwal,1,"ataba, dabka, dal'una, jinns, ma'anna, mankala, mijana, nay, oud, al-Salaamu 'alaykum, zajal",1,1,-,-
Six Days,"Barakat, Halim ",36939376,"Frangieh, Bassam & McGehee, Scott ","28219068, 56817597",Three Continents,N,0,N,,1990,USA,Arabic,1961,Syria,M,1,USA,37.09024,-95.712891,"M,M",1,"USA, USA",37.09024,-95.712891,Novel,120,,"Contents Page,   Dedication,   Translator's Afterword",N,0,-,-,-,0,-,0,-,0,-,0,0,-,-
Days of Dust,"Barakat, Halim ",36939376,"Le Gassick, Trevor",66476267,Three Continents,N,0,N,0,1992,USA,Arabic,1969,Lebanon,M,1,USA,37.09024,-95.712891,M,1,USA,37.09024,-95.712891,Novel,179,,"Contents Page,   Translator's Preface,   Author Bio",Y (Notes),1,19,Notes in introduction are references and explanations,-,0,-,0,-,0,-,0,0,-,-
The Stone of Laughter,"Barakat, Hoda",39364872,"Bennett, Sophie ",92938084,Interlink,N,0,N,0,1995,USA,Arabic,1990,Lebanon,F,0,France,46.227638,2.213749,F,0,UK,55.378051,-3.435973,Novel,209,,"Quotation,   Author's Acknowledgements",Y  (Notes),1,3,Notes in introduction are references of other books,-,0,-,0,-,0,-,0,0,Al-Naqid Prize,-
The Tiller of Waters,"Barakat, Hoda",39364872,"Booth, Marilyn ",14901543,AUC,Y,1,N,0,2001,Egypt,Arabic,1998,Lebanon,F,0,France,46.227638,2.213749,F,0,USA,37.09024,-95.712891,Novel,175,,"Contents Page,   Author and Translator Bio,   Epilogue",N,0,-,-,-,0,-,0,-,0,-,0,0,Naguib Mahfouz Prize,-
Disciples of Passion,"Barakat, Hoda",39364872,"Booth, Marilyn ",14901543,Syracuse University Press,Y,1,Y,1,2005,USA,Arabic,1993,Lebanon,F,0,France,46.227638,2.213749,F,0,USA,37.09024,-95.712891,Novel,136,,"Introduction,   Epilogue",N,0,-,-,-,0,-,0,-,0,-,0,0,-,-
"Oh, Salaam!","Barakat, Najwa",49339011,"Leafgren, Luke ",310615333,Interlink,N,0,Y,1,2014,USA,Arabic,1999,Lebanon,F,0,France,46.227638,2.213749,M,1,USA,37.09024,-95.712891,Novel,201,,Translator's Note,N,0,1,Yaa salaam,-,0,-,0,-,0,ya salaam,1,0,-,-
"I Was Born There, I Was Born Here","Barghouti, Mourid",37071425,"Davies, Humphrey",228562256,Walker & Company,N,0,N,0,2011,USA,Arabic,2009,Lebanon,M,1,Palestine,31.952162,35.233154,M,1,UK,55.378051,-3.435973,Novel,214,,"Contents Page,   Foreword",Y,1,12,"Hanthala, khamasin, the muqata'a, musakhan, the nakba, sandawitshat, shata'ir",-,0,"kanafeh, musakhan, sandawitshat, shata'ir",1,kufiya,1,"khamasin, rababa",1,0,-,-
I Saw Ramallah,"Barghouti, Mourid",37071425,"Soueif, Ahdaf",7550479,AUC,Y,1,Y,1,2000,Egypt,Arabic,1997,Egypt,M,1,Palestine,31.952162,35.233154,F,0,UK,55.378051,-3.435973,Memoir,182,,"Dedication,   Quotation,   Contents Page,   Foreword",Y,1,23,"al-Manfaluti, Fayruz, khala, kunafa, Mahmoud Darwish, qatayef, bismillah, hajja, khawaja, kufiya","bismillah, hajja",1,"kunafa, qatayef",1,kufiya,1,"dabka, khawaja",1,1,1997 Naguib Mahfouz Medal for Literature,-
I Saw Ramallah,"Barghouti, Mourid",37071425,"Soueif, Ahdaf",7550479,Anchor,N,0,Y,1,2003,USA,Arabic,1997,Egypt,M,1,Palestine,31.952162,35.233154,F,0,UK,55.378051,-3.435973,Memoir,182,,"Contents Page,   Foreword,   Glossary",Y,1,23,"al-Manfaluti, Fayruz, khala, kunafa, Mahmoud Darwish, qatayef, bismillah, hajja, khawaja, kufiya","bismillah, hajja",1,"kunafa, qatayef",1,kufiya,1,"dabka, khawaja",1,1,1997 Naguib Mahfouz Medal for Literature,-
Professor Hanaa,"Bassiouney, Reem",19965762,"Helmi, Laila ",252545183,Garnet,N,0,N,0,2011,UK,Arabic,2008,Egypt,F,0,Egypt,26.820553,30.802498,F,0,Lebanon,33.854721,35.862285,Novel,187,,"Dedication,   Quotation,   Author's Note",N,0,-,-,-,0,-,0,-,0,-,0,0,Sawiris Literary Award,-
Mortal Designs,"Bassiouney, Reem",19965762,"Magidow, Melanie ",2174145856998222920639,AUC,Y,1,Y,1,2016,Egypt,Arabic,2010,Lebanon,F,0,Egypt,26.820553,30.802498,F,0,USA,37.09024,-95.712891,Novel,235,,"Dedication,   Quotation,   Contents Page,   Author's Acknowledgements,   Author's Note",N,0,-,-,-,0,-,0,-,0,-,0,0,-,-
The Pistachio Seller,"Bassiouney, Reem",19965762,"Nusairi, Osman",16952456,Syracuse University Press,Y,1,Y,1,2009,USA,Arabic,2006,Egypt,F,0,Egypt,26.820553,30.802498,M,1,UK,55.378051,-3.435973,Novel,157,,"Quotation,   Dedication,   Author Bio",N,0,-,-,-,0,-,0,-,0,-,0,0,-,Arkansas Arabic Translation Award (2009)
The Game of Forgetting,"Berrada, Mohamed",98522437,"Boullatta, Issa J.  ",272292988,UT Austin,Y,1,Y,1,1996,USA,Arabic,1987,Morocco ,M,1,Morocco,31.791702,-7.09262,M,1,Canada,56.130366,-106.346771,Novel,128,,"Dedication,   Author's Note,   Translator's Note",Y (Notes),1,-,Notes in introduction are references and explanations,-,0,-,0,-,0,-,0,0,-,-
Fugitive Light,"Berrada, Mohamed",98522437,"Boullatta, Issa J.  ",272292988,Syracuse University Press,Y,1,Y,1,2002,USA,Arabic,1993,Morocco ,M,1,Morocco,31.791702,-7.09262,M,1,Canada,56.130366,-106.346771,Novel,171,,"Dedication,  Quotations,   Foreword,   Author's Note",N,0,-,-,-,0,-,0,-,0,-,0,0,-,-
Like a Summer Never to Be Repeated,"Berrada, Mohamed",98522437,"Phillips, Christina",21963312,AUC,Y,1,Y,1,2009,Egypt,Arabic,1999,Egypt,M,1,Morocco,31.791702,-7.09262,F,0,UK,55.378051,-3.435973,Novel,172,,"Dedication,  Quotations,   Translator's Introduction",Y,1,23,"Abdullah Nadim, futuwwa, harafish, ifreet, milaya, qanun, salep, umma, gallabiya, fuul, karkadeh, koshari, eid al-adha",eid al-adha,1,"fuul, karkadeh, koshari, salep",1,"gallabiya, milaya",1,"harafish, futuwwa, ifreet, umma",1,1,-,-
Blood Test,"Beydoun, Abbas",2624943,"Weiss, Max ",107347284,Syracuse University Press,Y,1,Y,1,2008,USA,Arabic,2002,Lebanon,M,1,Lebanon,33.854721,35.862285,M,1,USA,37.09024,-95.712891,Novel,121,,"Author Bio,   Translator Bio",N,0,-,-,-,0,-,0,-,0,-,0,0,-,King Fahd Center for Middle East & Islamic Studies: Translation of Arabic Literature 2007 Award Winner 
The House of Power,"Bindari, Sami",72678837,"Bindari, Sami & St. Leger, Mona","72678837, 109146331907318691904",Houghton Mifflin,N,0,N,0,1980,USA,Arabic,1971,Egypt,M,1,Lebanon,33.854721,35.862285,"M, F",-,Lebanon,33.854721,35.862285,Novel,214,,Publisher's Note,N,0,-,-,-,0,-,0,-,0,-,0,0,"Winner, Pegasus International Prize for Literature, 1978 (funded by Mobil Oil)",-
The Sheltered Quarter: A Tale of a Boyhood in Mecca,"Bogary, Hamza",43489031,"Kenny, Olive & Reed, Jeremy ","46873607, 92441683",UT Austin,Y,1,Y,1,1991,USA,Arabic,1983,Saudi Arabia,M,1,Saudi Arabia,23.885942,45.079162,"F,M",-,Canada,56.130366,-106.346771,Novel,104,,"Contents Page,   Author Bio,   Foreword,   Acknowledgements,   Introduction",Y + Notes,1,3 (Endnotes of introduction); 61 (Endnotes of Book); 50 (glossary entries),"Notes in introduction are references and explanations; Endnote Entries- arafa day, ba and ta, al-duhul, shangeeti, al-milal wa'l-nihal, quraish; Glossary Entries- 'afareet, halala, al-hareera, ma'sub, 'areeka, dibyaza, raushan, sufi, umra, zar","afareet, faqeeha, al-fatiha, hajj, haram, hawqala, jinn",1,"areeka, batasa, dibyaza, al-hareera, ",1,"igal, jubba",1,"amm, bazan, diwan, halala",1,1,-,-
Flesh and the Devil,"Boof, Kola",233531028,"Musa, Said",52939338,Door of Kush,N,0,Y,1,2004,USA,Arabic,1995,Morocco,F,0,USA,37.09024,-95.712891,M,1,USA,37.09024,-95.712891,Novel,339,,"Dedication,   Acknowledgements,   Afterword,   Poems",N,0,-,-,-,0,-,0,-,0,-,0,0,-,-
My Grandmother's Cactus: Stories by Egyptian Women,"Booth, Marilyn (compiler/translator), collection includes Radwa Ashour, Salwa Bakr, Seham Bayomi, Neamat al-Biheiri, Etidal Osman, Mona Ragab, Ibtihal Salem, Sahar Tawfiq",14901543,"Booth, Marilyn",14901543,Quartet,N,0,Y,1,1991,UK,Arabic,Misc.,Misc.,F,0,Egypt,26.820553,30.802498,F,0,USA,37.09024,-95.712891,Short stories,148,,"Contents Page,   Preface,  Acknowledgements,   Author Bio,   Glossary,   Introduction,   Notes",Y + Notes,1,4 (glossary); 60 (notes),"dumyana, foul, mulukhiyya, niqab, amm, effendi, khala, sitti, darrasa, firman, rami, suna, dayra, Tahrir Square",dumyana,1,"foul, mulukhiyya",1,niqab,1,"amm, effendi, khala, sitti, darrasa, firman, rami, suna, dayra, Tahrir Square",1,0,-,-
Five Eyes,"Bowles, Paul (compiler/translator); Boulaich, Abdeslam, Mohamed Choukri, Larbi Layachi, Mohammed Mrabet, Ahmed Yacoubi",112464042,"Bowles, Paul ",112464042,Black Sparrow,N,0,Y,1,1979,USA,Arabic,Misc.,Misc.,M,1,"Morocco, USA",40.9461457,-87.4533626,M,1,Morocco,31.791702,-7.09262,Short stories,133,,"Translator's Acknowledgements,   Contents Page,   Translator Bio,   Image,   Author and Translator Bio",N,0,-,-,-,0,-,0,-,0,-,0,0,-,-
Code Name: Butterfly,"Bsharat, Ahlam",-,"Roberts, Nancy",47001671,Neem Tree,N,0,N,0,2016,UK,Arabic,2009,Palestine,F,0,Palestine,31.952162,35.233154,F,0,USA,37.09024,-95.712891,Novel,90,,"Author Bio,   Award Information,   Dedication,   Contents Page,   Glossary",Y,1,17,"Abu Ammar, Eid al Adha, Eid al Fitr, hajja, Sunnah, harisa, turmus, thobe, Al Jawwal, intifada, martyr, Shami and Maghrebi, Six Day War","Eid al Adha, Eid al Fitr, hajja, Sunnah",1,"harisa, turmus",1,thobe,1,"Al Jawwal, intifada, martyr, Shami and Maghrebi, Six Day War",1,1,IBBY Honor List 2012,-
Chewing Gum,"Bushnaf, Mansour",314872142,"Zaki, Mona ",95046474,Darf,N,0,N,0,2014,UK,Arabic,2008,Egypt,M,1,Libya,26.3351,17.228331,F,0,USA,37.09024,-95.712891,Novel,123,,Author Bio,N,0,-,-,-,0,-,0,-,0,-,0,0,-,-
A Life Full of Holes,"Charhadi, Driss ben Hamed",95170015,"Bowles, Paul ",112464042,Harper Perennial ,N,0,Y,1,2008,USA,Arabic,1982,Morocco,M,1,Morocco,31.791702,-7.09262,M,1,Morocco,31.791702,-7.09262,Novel,295,,"Quotation,   Contents Page,   Foreword,   Translator's Introduction,   Author and Translator Bio,    About the Book,   Short Story,    Have you read? More by Paul Bowles",N,0,-,-,-,0,-,0,-,0,-,0,0,-,-
Jean Genet in Tangier,"Choukri, Mohamed",114270495,"Bowles, Paul",112464042,Ecco Pr,N,0,Y,1,1974,USA,Arabic,-,-,M,1,Morocco,31.791702,-7.09262,M,1,Morocco,31.791702,-7.09262,Novel,74,,"Foreword,   Images,   Afterword,   Author and Translator Bio",N,0,-,-,-,0,-,0,-,0,-,0,0,-,-
Tennessee Williams in Tangier,"Choukri, Mohamed",114270495,"Bowles, Paul",112464042,Cadmus Editions,N,0,Y,1,1979,USA,Arabic,-,-,M,1,Morocoo,31.791702,-7.09262,M,1,Morocco,31.791702,-7.09262,Novel,71,,"Image,   Foreword,   Note,   Author and Translator Bio",N,0,-,-,-,0,-,0,-,0,-,0,0,-,-
For Bread Alone,"Choukri, Mohamed ",114270495,"Bowles, Paul",112464042,City Lights,N,0,Y,1,1987,USA,Arabic,1973,UK,M,1,Morocco,31.791702,-7.09262,M,1,Morocco,31.791702,-7.09262,Novel,144,,"Contents Page,   Footnotes,   Glossary",Y,1,25,"aaita, dfin, harira, mahia, maricon, sala, sebsi, taifor, tajine, zib","fjer, surah, tolba",1,"harira, limonada, mahia, tajine, tapas",1,"dfin, djellaba, zigdoun",1,"aaita, baqal, hammam, maricon, qahouaji, zib",1,0,-,-
Streetwise,"Choukri, Mohamed ",114270495,"Emery, Ed ",232393010,Saqi Books,N,0,Y,1,1996,UK,Arabic,1992,Lebanon,M,1,Morocco,31.791702,-7.09262,M,1,UK,55.378051,-3.435973,Novel,156,,"Translator's Introduction,   Glossary",Y+ Notes,1,7,"carajol, kif, majoun, shaqfa, taifor",-,0,carajol,1,djellaba,1,"kif, majoun, sabi, shaqfa, taifor",1,0,-,-
Limbo Beirut,"Chouman, Hilal",283542802,"Ziajka Stanton, Anna",109147662852660550687,UT Austin,Y,1,Y,1,2016,USA,Arabic,2013,Egypt,M,1,UAE,23.424076,53.847818,F,0,USA,37.09024,-95.712891,Novel,214,,"Dedication,   Translator's Note,   Author's Acknowledgements",N,0,-,-,-,0,-,0,-,0,-,0,0,-,-
Always Coca-Cola,"Chreiteh, Alexandra",171992881,"Hartman, Michelle ",61797730,Interlink,N,0,Y,1,2012,USA,Arabic,2009,Lebanon,F,0,Lebanon,33.854721,35.862285,F,0,Canada,56.130366,-106.346771,Novel,121,,Translator's Acknowledgements,N,0,-,-,-,0,-,0,-,0,-,0,0,-,-
Ali and His Russian Mother,"Chreiteh, Alexandra",171992881,"Hartman, Michelle ",61797730,Interlink,N,0,Y,1,2015,USA,Arabic,2009,Lebanon,F,0,USA,37.09024,-95.712891,F,0,Canada,56.130366,-106.346771,Novel,93,,"Historical Info,   Afterword,   Translator's Note,   Translator's Acknowledgements",N,0,-,-,-,0,-,0,-,0,-,0,0,-,-
The Book of Khartoum,"Cormack, Raph and Shmookler, Max (editors); misc. authors",124147118197426340987,Misc.,-,Comma Press,N,0,N,0,2016,UK,Arabic,1974-2009,Misc.,Misc.,-,Sudan,12.862807,30.217636,Misc.,-,Misc.,40.6726957,-73.9574853,Short stories ,72,,"Contents Page,   Map,   Editor's Introduction,   Footnotes,   Author Bio,   Translator Bio",Y (Notes),1,26,"Al-Haj Mohammed Ahmed Suror, shahada, dervish, millet and milk, jellabiya, Sudan geography, poetry, afreet, nikah 'urfi, Sudanese history, nihas, shuloukh scars","shahada, dervish",1,millet and milk,1,jellabiya,1,"Sudan geography, poetry, afreet, nikah 'urfi, Sudanese history, nihas, shuloukh scars",1,1,-,-
The Hostage,"Dammaj, Zayd Muti",119095692,"Jayyusi, May & Tingley, Christopher ","15007166, 61676886",Interlink,N,0,Y,1,1994,USA,Arabic,1984,Lebanon,M,1,Yemen,15.552727,48.516388,"F, M",-,"Palestine, UK",31.793874,35.2326652,Novel,129,,"Preface,   Contents Page,   Preface,   Introduction,   Introduction,   Translator Bio",N,0,-,-,-,0,-,0,-,0,-,0,0,Selected by the Arab Writers Union as one of the 100 best Arabic novels of the 20th century,-
The Penguin's Song,"Daoud, Hassan",27211994,"Booth, Marilyn ",14901543,City Lights,N,0,Y,1,2014,USA,Arabic,1998,Lebanon,M,1,Lebanon,33.854721,35.862285,F,0,USA,37.09024,-95.712891,Novel,214,0,None,N,0,-,-,-,0,-,0,-,0,-,0,0,Muntada Cultural Prize for the best Lebanese book of 1998,-
No Road to Paradise,"Daoud, Hassan",27211994,"Booth, Marilyn ",14901543,Hoopoe,Y,1,Y,1,2017,USA,Arabic,2013,Lebanon,M,1,Lebanon,33.854721,35.862285,F,0,UK,55.378051,-3.435973,Novel,298,,Dedication,N,0,-,-,-,0,-,0,-,0,-,0,0,2015 Naguib Mahfouz Medal,-
The Year of the Revolutionary New Bread-making Machine,"Daoud, Hassan",27211994,"Jarrar, Randa",79248744,Telegram Books,N,0,N,0,2007,UK,Arabic,1996,Lebanon,M,1,Lebanon,33.854721,35.862285,F,0,USA,37.09024,-95.712891,Novel,144,,Glossary,N,0,-,-,-,0,-,0,-,0,-,0,0,-,-
Borrowed Time,"Daoud, Hassan",27211994,"Scott, Michael K. ",-,Telegram,N,0,N,0,2000,Lebanon,Arabic,1998,Lebanon,M,1,Lebanon,33.854721,35.862285,M,1,USA,37.09024,-95.712891,Novel,157,,Praise for Translation,Y (Notes),1,26,"Aya Kabeera, Debbas Square, Franji, Ka'ak, Mastaba, Sherwaal, hajj, halwa, labneh, 'id, muezzin, sherwaal, tarboosh","aya kabeera, hajj, muezzin",1,"ka'ak, halwa, labneh",1,"sherwaal, tarboosh",1,id,1,0,-,-
The House of Mathilde,"Daoud, Hassan",27211994,"Theroux, Peter ",92000990,Granta Publications,N,0,Y,1,2002,UK,Arabic,1983,Lebanon,M,1,Lebanon,33.854721,35.862285,M,1,USA,37.09024,-95.712891,Novel,179,,Author and Translator Bio,N,0,-,-,-,0,-,0,-,0,-,0,0,-,-
Autumn Equinox,"Douaihy, Jabbour",69101116,"Hannawi, Nay ",68274445,University of Arkansas Press,Y,1,Y,1,2001,Canada,Arabic,1995,Lebanon,M,1,Lebanon,33.854721,35.862285,F,0,Kuwait,29.31166,47.481766,Novel,126,,Dedication,N,0,-,-,-,0,-,0,-,-,-,0,0,-,Arkansas Arabic Translation Award
The American Quarter,"Douaihy, Jabbour",69101116,"Haydar, Paula",7665444,Interlink,N,0,Y,1,2018,USA,Arabic,2014,Lebanon,M,1,Lebanon,33.854721,35.862285,F,0,USA,37.09024,-95.712891,Novel,170,,None,N,0,-,-,-,0,-,0,-,0,-,0,0,-,-
June Rain,"Douaihy, Jabbour",69101116,"Haydar, Paula ",7665444,Bloomsbury Qatar,N,0,Y,1,2014,UK,Arabic,2006,Lebanon,M,1,Lebanon,33.854721,35.862285,F,0,USA,37.09024,-95.712891,Novel,310,,"Dedication,   Author Bio,   Translator Bio",N,0,-,-,-,0,-,0,-,0,-,0,0,Shortlisted for the International Prize for Arabic Fiction,Highly Commended for the Banipal Prize for Arabic Translation
A Certain Woman ,"El Badry, Hala",7662674,"Abdel Wahab, Farouk ",97603587,AUC,Y,1,Y,1,2003,Egypt,Arabic,2001,Egypt,F,0,Egypt,26.820553,30.802498,M,1,USA,37.09024,-95.712891,Novel,216,,Translator's Note,N,0,-,-,-,0,-,0,-,0,-,0,0,Winner of the best novel prize at the Cairo International Book Fair (2001),-
Rain over Baghdad,"El Badry, Hala",7662674,"Abdel Wahab, Farouk ",97603587,AUC,Y,1,Y,1,2014,Egypt,Arabic,2010,Iraq,F,0,Egypt,26.820553,30.802498,M,1,USA,37.09024,-95.712891,Novel,475,,"Dedication,   Glossary",Y,1,52,"abuna, al-Hallaj, shahada, fitir mishaltit, halawa, kahi, masghouf, mumbar, samun bread, abaya, abla, abu, umm, ajami, dabka, majlis, shabka, sitt, ustaz, ustaza","abuna, al-Hallaj, shahada",1,"fitir mishaltit, halawa, kahi, masghouf, mumbar, samun bread",1,"abaya, ",1,"abla, abu, umm, ajami, dabka, majlis, shabka, sitt, ustaz, ustaza",1,0,-,-
Muntaha,"El Badry, Hala",7662674,"Roberts, Nancy ",47001671,AUC,Y,1,Y,1,2006,Egypt,Arabic,1995,Egypt,F,0,Egypt,26.820553,30.802498,F,0,USA,37.09024,-95.712891,Novel,211,,"Dedication,   Glossary",Y,1,44,"Al-salaam 'alaykum, dhikr, hagg, ma'zun, qibla, gullash, hummusiya, kunafa, mitaggin, thareed, basbusa, ta'miya, siga, umm, naruza","Al-salaam 'alaykum, dhikr, hagg, ma'zun, qibla",1,"gullash, hummusiya, kunafa, mitaggin, thareed, basbusa, ta'miya",1,-,0,"siga, umm, naruza",1,1,-,-
Talk of Darkness,"El Bouih, Fatna",61250587,"Kamal, Mustapha & Slyomovics, Susan","86261247, 76441399",UT Austin,Y,1,Y,1,2008,USA,Arabic,2001,Morocco,F,0,Morocco,31.791702,-7.09262,"M, F",-,USA,37.09024,-95.712891,Memoir,95,,"Dedication,   Contents Page,   Translator's Introduction,   Chronology,   Endnotes",Y (Notes),1,19,"Saida Menebhi, Quranic references, Ramadan, Moroccan pronounciation, sayings, cabrana, prison explanations","Quranic references, Ramadan",1,-,0,-,0,"Moroccan pronounciation, sayings, cabrana, prison explanations",1,1,-,-
House of the Wolf,"El Kamhawi, Ezzat",42258265,"Roberts, Nancy",47001671,AUC,Y,1,Y,1,2013,Egypt,Arabic,2010,Lebanon,M,1,Egypt,26.820553,30.802498,F,0,USA,37.09024,-95.712891,Novel,265,,"Image,   Glossary",Y,1,42,"Arak, asida, cover me up and wail over me, fatta, gilbab, kunafa, maybe you grabbed a cat's tail, murad bey, salep, ta'miya, asaliya, dhikr, gallabiya, ma'zun, mulukhiya, qibla","dhikr, ma'zun, qibla",1,"arak, asaliya, asida, fatta, kunafa, mulukhiya, salep, ta'miya",1,"gallabiya, gilbab",1,cover me up and wail over me,1,1,Naguib Mahfouz Medal (2012),-
The Circling Song,"El Saadawi, Nawal",84254254,-,-,Zed Books,N,0,N,0,1989,UK,Arabic,1976,Lebanon,F,0,Egypt,26.820553,30.802498,-,-,-,,,Novel,79,0,None,Y (Notes),1,7,"gallabiyya, alms, Egypt geography",alms,1,-,0,gallabiyya,1,-,0,1,-,-
The Novel,"El Saadawi, Nawal",84254254,"Amin, Omnia & London, Rick","4875237, 43370146",Interlink,N,0,Y,1,2009,USA,Arabic,2005,Egypt,F,0,Egypt,26.820553,30.802498,"F, M",-,"UAE, USA",40.7547199,-73.979465,Novel,236,,Contents Page,N,0,-,-,-,0,-,0,-,0,-,0,0,-,-
Memoirs of a Woman Doctor,"El Saadawi, Nawal",84254254,"Cobham, Catherine ",24756669,City Lights,N,0,N,0,1989,USA,Arabic,1958,Egypt,F,0,Egypt,26.820553,30.802498,F,0,UK,55.378051,-3.435973,Novel,92,,"Dedication,   Contents Page,   Author's Preface",N,0,-,-,-,0,-,0,-,0,-,0,0,-,-
She Has No Place in Paradise,"El Saadawi, Nawal",84254254,"Eber, Shirley ",69100087,Methuen,N,0,N,0,1987,UK,Arabic,1979,Lebanon,F,0,Egypt,26.820553,30.802498,F,0,UK,55.378051,-3.435973,Short stories,167,,Quotation,N,0,-,-,-,0,-,0,-,0,-,0,0,-,-
Searching,"El Saadawi, Nawal",84254254,"Eber, Shirley ",6910087,Zed Books,N,0,N,0,1991,UK,Arabic,1968,Egypt,F,0,Egypt,26.820553,30.802498,F,0,UK,55.378051,-3.435973,Novel,111,,"Author's Preface,   Author Bio,   Book Reviews",N,0,-,-,-,0,-,0,-,0,-,0,0,-,-
Love in the Kingdom of Oil,"El Saadawi, Nawal",84254254,"Hatim, Basil & Williams, Malcolm ","44451363, 47038933",Saqi Books,N,0,N,0,2001,UK,Arabic,1993,Egypt,F,0,Egypt,26.820553,30.802498,"M, M",1,UK,55.378051,-3.435973,Novel,129,0,None,N,0,-,-,-,0,-,0,-,0,-,0,0,-,-
A Daughter of Isis: The Autobiography of Nawal El Saadawi,"El Saadawi, Nawal",84254254,"Hetata, Sherif",32229967,Zed Books,N,0,N,0,1999,UK,Arabic,1988,Egypt,F,0,Egypt,26.820553,30.802498,M,1,Egypt,26.820553,30.802498,Memoir,289,,Author Bio,Y (Notes),1,40,"Noon, Ashtar, Azraeen, mulukheya, halawa, mughat, gallabeya, tarha, giba, kaftan, pantoufles, al-tawgeheya, za’laa, Bo’o Bo’o Effendi, suffragui, piastre, effendi, um, hajja","Noon, Ashtar, Azraeen",1,"mulukheya, halawa, mughat",1,"gallabeya, tarha, giba, kaftan, pantoufles",1,"al-tawgeheya, za’laa, Bo’o Bo’o Effendi, suffragui, piastre, effendi, um, hajja",1,1,-,-
Woman at Point Zero,"El Saadawi, Nawal",84254254,"Hetata, Sherif ",32229967,Zed Books,N,0,N,0,1983,USA,Arabic,1975,Lebanon,F,0,Egypt,26.820553,30.802498,M,1,Egypt,26.820553,30.802498,Novel,108,,"Author's Introduction,   Glossary",N,0,-,-,-,0,-,0,-,0,-,0,0,,
